아무도 살아서 나갈 수 없다,관람객 평점 없음,"['미스터리', '공포']",영국,86분,['미상'],['마크 멘차카'],청소년 관람불가,https://movie-phinf.pstatic.net/20211012_193/1634007260839FwVvQ_JPEG/movie_image.jpg?type=m203_290_2,"['절박한 심정으로 미국에 밀입국한 멕시코 여성. 허름한 클리블랜드 하숙집에서 묵으면서 섬뜩한 환영에 시달린다. 수상한 집주인, 불길한 울음소리, 알 수 없는 형체까지. 이곳엔 무언가가 있다.']"
드림걸: 수상한 콜센터,관람객 평점 없음,['코미디'],인도,125분,['미상'],"['아유쉬만 커라나', '비자이 라즈']",12세 관람가,https://movie-phinf.pstatic.net/20210929_200/1632896454138sbnvD_JPEG/movie_image.jpg?type=m203_290_2,"['카람은 여자 목소리를 내는 데 천부적인 재능이 있는 남자로, 적절한 직업을 찾던 도중 월 70000루피를 지급한다는 곳으로 찾아간다. 면접관 마우지는 이곳은 여성 교환원들로만 이루어진, 환상을 충족시키기 위한 콜센터라며 남자인 카람을 탈락시킨다. 카람은 콜센터로 걸려온 전화 중 하나를 받아 그의 능력을 활용해 푸자라는 이름의 여성으로 완벽하게 응대함으로써 주변 모두를 놀라게 한다. 마우지는 그를 고용하고 사업은 곧 번창하여 카람은 그의 처남 마힌더를 비롯한 수많은 추종자를 거느리게 된다. 심지어 그의 아버지 자그짓 싱마저 카람의 팬이 되면서 어느 순간 카람은 그의 연인 마히가 이 일을 알게 되면 어떻게 될지 전전긍긍하게 되는데…']"
트립,관람객 평점 없음,"['공포', '코미디']",노르웨이,113분,['미상'],"['누미 라파스', '엑셀 헨니', '아틀레 안톤센']",청소년 관람불가,https://movie-phinf.pstatic.net/20211110_292/1636526142844WB1sO_JPEG/movie_image.jpg?type=m203_290_2,['분노만 남은 결혼 생활. 부부는 서로를 죽이려는 계획을 숨기고 외딴 산장으로 여행을 떠난다. 하지만 진짜 적은 서로가 아니었으니. 그곳에서 더 큰 위험이 두 사람을 기다리고 있다.']
바다 탐험대 옥토넛 : 육지수호 대작전,관람객 평점 6.00점,"['애니메이션', '액션', '모험']",영국,60분,2021.10.27,"['하성용', '정재헌', '엄상현']",전체 관람가,https://movie-phinf.pstatic.net/20210924_146/1632472857227W3TMy_JPEG/movie_image.jpg?type=m203_290_2,"['바다 폭풍에 휩쓸린 옥토넛은 우연히 사막에 상륙한다.\r', <br/>, '\xa0바다 너머 육지에도 다양한 문제들이 있음을 알게 된 옥토넛.\r', <br/>, '\xa0‘옥토 요원’으로 새 친구 ‘포니’가 합류하고,\r', <br/>, '\xa0옥토포드 조종사 ‘대쉬’는 새로운 탐험선 ‘옥토레이’에 탑승해\r', <br/>, '\xa0사상최초 육지수호 대작전을 이끄는데...\r', <br/>, '\xa0해안부터 사막까지, 깊은 바다에서 높은 산 정상까지!\r', <br/>, '\xa0옥토넛의 새로운 모험이 지금 시작된다!']"
왕십리 김종분,관람객 평점 없음,['다큐멘터리'],한국,102분,2021.11.11,"['김종분', '김귀임', '김종수']",12세 관람가,https://movie-phinf.pstatic.net/20211026_135/16352352904529aeAA_JPEG/movie_image.jpg?type=m203_290_2,"['50년 넘게 노점을 해온 팔순의 김종분.', <br/>, '\xa0왕십리역 11번 출구 터줏대감이자 현역이다.', <br/>, '\xa0', <br/>, '\xa0자식 먹이고 입히고 공부시키려고 시작한 일인데,', <br/>, '\xa0자식 거둘 일 없어진 지금도 그곳을 지키고 있다.', <br/>, '\xa030년 전 길 위에서 딸을 잃었지만, 더 많은 자식들을 얻었다.', <br/>, '\xa0', <br/>, '\xa0종분 씨는 딸 잃은 길 위에서', <br/>, '\xa0옥수수를 삶고, 가래떡을 굽고, 깻잎을 갠다.', <br/>, '\xa0오늘을 산다.']"
사냥감,관람객 평점 없음,['스릴러'],독일,86분,['미상'],['15세 관람가'],['전체 관람가'],https://movie-phinf.pstatic.net/20210924_114/1632464606756P3EW6_JPEG/movie_image.jpg?type=m203_290_2,"['하이킹 여행을 떠난 다섯 남자. 숲에서는 이따금 총성이 들려온다. 한 발, 한 발 총성이 조금씩 가까워지고 남자들은 뒤늦게 깨닫는다. 사냥꾼이 노리는 사냥감은 바로 자신들이라는 것을.']"
나이트북: 밤의 이야기꾼,관람객 평점 없음,['미스터리'],미국,101분,['미상'],"['윈슬로우 페글리', '크리스틴 리터']",12세 관람가,https://movie-phinf.pstatic.net/20211005_64/1633395939326qpPnG_JPEG/movie_image.jpg?type=m203_290_2,['무서운 이야기에 푹 빠져 지내는 소년 알렉스. 우연히 마녀의 집에 들어갔다가 갇혀버리고 만다. 매일 밤 무서운 이야기를 들려달라는 마녀의 황당한 요구. 세상에 이런 마녀도 있나요?']
결혼 후에 남겨진 것들,관람객 평점 없음,"['멜로/로맨스', '드라마']",미국,97분,2021.10,"['로스 맥콜', '앨리슨 밀러']",['전체 관람가'],https://movie-phinf.pstatic.net/20210928_272/1632791807061fiSix_JPEG/movie_image.jpg?type=m203_290_2,"['10년 된 부부 라이언과 클로디아는 옛 추억을 떠올리며, 신혼여행지 이탈리아를 다시 찾는다.\r', <br/>, '\xa0두 사람은 아름다운 풍경 속에서 함께 시간을 보내며, 오랜 결혼 생활로 잃어버린 무언가를 되찾으려 한다.\r', <br/>, '\xa0하지만 클로디아가 다른 남자에게 쓴 연애편지를 라이언이 언급하면서 두 사람 사이의 갈등은 더욱 깊어지는데...']"
더 하더 데이 폴,관람객 평점 6.56점,"['액션', '모험']",미국,137분,2021.10.20,"['조나단 메이저스', '재지 비츠', '이드리스 엘바']",청소년 관람불가,https://movie-phinf.pstatic.net/20211013_124/1634113091609idAKj_JPEG/movie_image.jpg?type=m203_290_2,['숙적 루푸스 벅이 출소한 사실을 알게 된 서부의 무법자 냇 러브가 미뤄뒀던 복수를 마무리하기 위해 흩어졌던 팀을 모아 그의 뒤를 추격하며 벌어지는 활극을 그린 서부영화']
고장난 론,관람객 평점 8.48점,['애니메이션'],미국,106분,2021.10.27,"['자흐 갈리피아나키스', '잭 딜런 그레이저', '올리비아 콜맨']",전체 관람가,https://movie-phinf.pstatic.net/20211013_94/1634115796140K407h_JPEG/movie_image.jpg?type=m203_290_2,"['비봇을 갖는 것이 유일한 소원인 소심한 소년 ‘바니’에게도', <br/>, '\xa0드디어 ‘론’이라는 비봇이 생겼다.', <br/>, '\xa0', <br/>, '\xa0그러나 첨단 디지털 기능과 소셜 미디어로 연결된 다른 비봇들과는 달리,', <br/>, ""\xa0네트워크 접속이 불가능한 고장난 '론'"", <br/>, '\xa0', <br/>, ""\xa0자유분방하고 엉뚱한 '론'으로 인해 벌어지는"", <br/>, '\xa0엉망진창, 스릴 넘치는 모험을 함께하며', <br/>, ""\xa0'바니'는 진실한 우정이 무엇인지 점점 깨닫게 되는데.."", <br/>, '\xa0', <br/>, '\xa0<인사이드 아웃> & <인크레더블 2> 제작진이 선사하는', <br/>, '\xa0새로운 우정과 특별한 모험이 시작된다!']"
상견니 대만판 13화,관람객 평점 8.17점,"['드라마', '멜로/로맨스', 'SF']",대만,71분,2021.09.08,"['가가연', '허광한', '시백우']",12세 관람가,https://movie-phinf.pstatic.net/20210914_255/1631598588065xqqMt_JPEG/movie_image.jpg?type=m203_290_2,[]
피어썸,관람객 평점 없음,"['공포', '미스터리']",한국,82분,2021.10.07,"['조동혁', '차선우']",15세 관람가,https://movie-phinf.pstatic.net/20210917_247/1631854202877hx03Y_JPEG/movie_image.jpg?type=m203_290_2,"['공연을 할 수 없게 된 ‘승연’(조동혁)의 밴드는', <br/>, '\xa0재정비를 위해 춘천으로 떠나고,', <br/>, '\xa0우연히 그곳 클럽에서 멋진 실력을 보여준 그들은', <br/>, '\xa0정식 공연 제안과, 멋진 숙소까지 제공받게 된다.', <br/>, '\xa0', <br/>, '\xa0하지만 휴식도 잠시 기타리스트 ‘재혁’(차선우)이', <br/>, '\xa0뭔가에 홀린 듯 점점 섬뜩한 행동을 하기 시작하고,', <br/>, '\xa0곧 이 집에 자신들만 있는 게 아니라는 사실을 알게 되는데…']"
저승까지 파티피플!,관람객 평점 없음,['코미디'],미국,109분,['미상'],"['빅토리아 저스티스', '아담 가르시아']",12세 관람가,https://movie-phinf.pstatic.net/20210908_118/1631089177030cNcPw_JPEG/movie_image.jpg?type=m203_290_2,"['캐시의 인생은 언제나 파티였다. 짜릿한 날들이 이어졌다. 하지만 너무 일찍, 너무 갑자기 끝나버린 삶. 이제 그녀는 마무리하지 못한 일들을 끝내야 한다. 저 높은 곳으로 올라가기 위해.']"
피치 오브 타임 극장판,관람객 평점 없음,"['멜로/로맨스', '드라마']",한국,99분,2021.10.21,"['지미 칸 크리사나판', '최재현', '토미 싯티촉 푸에크풀폴']",12세 관람가,https://movie-phinf.pstatic.net/20210930_277/1632967172071mdLTA_JPEG/movie_image.jpg?type=m203_290_2,"['친구 윤오의 연락을 받고 한국에 도착한 피치.', <br/>, '\xa0그렇게 날 반갑게 맞아준 윤오가 사실은 귀신이라고?!', <br/>, '\xa025년째 한국을 떠나지 못하는 떠돌이 태국 귀신 마리오를 만난 피치는', <br/>, '\xa0윤오가 자신이 죽었다는 사실도 모른 채 지박령이 되었다는 걸 알게 된다.', <br/>, '\xa0악귀가 되지 않고 무사히 환생하려면', <br/>, '\xa0죽은 날로부터 49일안에 이승에서 풀지 못한 한을 풀어야 한다!', <br/>, '\xa0도대체 윤오가 그토록 원하던 일이 무엇이었을까?', <br/>, '\xa0함께 버킷리스트를 찾아가면서', <br/>, '\xa0서로를 향한 마음은 점점 커져가고 이별의 시간이 다가오는데…']"
가치 캅시다,관람객 평점 7.40점,['드라마'],한국,93분,2021.10.28,"['김기현', '강형석', '남지우']",15세 관람가,https://movie-phinf.pstatic.net/20211012_41/1634028856253Gj3tU_JPEG/movie_image.jpg?type=m203_290_2,"['대한민국에서 영어 좀 한다는 남자라면 혹하는, 일생에 단 한 번만 지원할 수 있는 군대 카투사. 엘리트 명문대와 금수저들이 장악한 이 곳에 최종 학력 고졸의 말년 병장 추해진이 있다. 어떤 의미로든 전설로 불리는 해진은 학연, 지연, 혈연까지 온갖 차별이 판치는 한국 탈출을 위한 돌파구로 ‘미군’을 준비한다. 갖은 모욕에도 비굴한 웃음을 잃지 않고 최선을 다한 결과, 미군 입대를 눈앞에 두고 느닷없는 절도사건에 휘말리면서 탄원서에5명의 서명을 받아야만 한다. 절친한 동갑내기 후임, 재벌아들 이등병, 전 여친을 빼앗은 후임, 미군이 되기 위해서라면 선임이고 후임이고 누구에게라도 머리를 조아리고 한 명씩 찾아 나선다. 인종주의자 미군헌병에게 총을 맞을 뻔하면서까지 고군분투하던 해진은 필사적으로 서명을 받아내지만, 자신이 미군이 된다는 것을 지독히 반대하는 누군가를 설득해야 하는 마지막 절차가 남았는데...! \r', <br/>, '\xa0\r', <br/>, '\xa0“아무 것도 가진 것 없는 네가 잘 되는 게 그냥 싫어!”\r', <br/>, '\xa0한국을 벗어나기 위한 선택지가 미군이 되는 것, 그 하나만이 아니었다?!\r', <br/>, '\xa0눈 돌아간 해진의 충격적인 반격을 확인하라!']"
클리너:살인마의 집,관람객 평점 없음,['스릴러'],미국,85분,2021.10.28,['청소년 관람불가'],['전체 관람가'],https://movie-phinf.pstatic.net/20211018_184/1634534872528hzJVt_JPEG/movie_image.jpg?type=m203_290_2,"['성희롱이 심한 브래드 밑에서 일하던 사라와 알튼은 어느 날 브래드에게 사기 의심을 받고 해고된다. 아들과 이사를 가기 위해 임시직으로 범죄 현장 특수 청소 일을 하게 되는데, 두 번째로 출근한 장소인 공장에는 끔찍하게 살해된 시체들이 많았다. 살인범이 없는지 확인해 달라는 사라의 말을 듣고 사장인 도리안은 토드에게 현장 확인을 부탁하고, 다른 직원들에겐 하나씩 어둠이 드리우는데...']"
레드 아워,관람객 평점 없음,"['액션', '스릴러']",미국,93분,2021.10,"['타이레스 깁슨', '존 말코비치']",15세 관람가,https://movie-phinf.pstatic.net/20210923_101/1632377012095mnKGS_JPEG/movie_image.jpg?type=m203_290_2,"['아동보호국에서 근무하는 카일은 아프가니스탄 파병지에서 동료를 잃었던 끔찍한 기억으로 힘든 나날을 보낸다.\r', <br/>, '\xa0직장 동료와 맥시코 출신 미아 매니와 함께 계부이자 하원의원인 샘이 운영하는 넬슨 매장에 잠시 들렀던 카일은 매장 직원들 및 다른 고객들과 함께 자살폭탄 테러범의 인질이 된다.\r', <br/>, '\xa0카일은 다른 인질들을 구하기 위해 테러범과 목숨을 건 싸움 끝에 테러범들을 제압하고 인질들과 함께 폭파 직전에 매장에서 탈출해야만 하는데...']"
미켈란젤로,관람객 평점 8.14점,"['드라마', '다큐멘터리']",이탈리아,97분,2021.09.29,['12세 관람가'],['전체 관람가'],https://movie-phinf.pstatic.net/20210909_57/1631165983167dxDxX_JPEG/movie_image.jpg?type=m203_290_2,['미켈란젤로의 생애와 작품 세계를 다룬 다큐멘터리']
비하인드 유,관람객 평점 없음,['공포'],미국,86분,2021.10.28,"['애디 밀러', '잔 브로버그 펠트', '필립 브로디']",15세 관람가,https://movie-phinf.pstatic.net/20211006_242/16334966809722d0b0_JPEG/movie_image.jpg?type=m203_290_2,"['엄마의 갑작스러운 죽음으로\r', <br/>, '\xa0‘베스’ 이모의 집으로 오게 된 ‘올리비아’와 ‘클레어’.\r', <br/>, '\xa0그날 밤, 기묘한 목소리를 듣게 된 ‘클레어’는 언니 몰래\r', <br/>, '\xa0출입금지였던 지하실로 들어가게 되고,\r', <br/>, '\xa0그곳에서 충격적인 실체와 마주하게 되는데…']"
일곱 개의 대죄: 빛에 저주받은 자들,관람객 평점 없음,"['애니메이션', 'SF', '판타지']",일본,79분,['미상'],"['카지 유우키', '아마미야 소라', '쿠노 미사키']",15세 관람가,https://movie-phinf.pstatic.net/20211018_292/1634525952830t8Ji2_JPEG/movie_image.jpg?type=m203_290_2,['마침내 성전이 끝났다. 3천 년에 걸친 싸움에 종지부를 찍은 일곱 대죄. 하지만 혼돈을 바라는 자들이 모두 사라진 것은 아니었으니. 새로운 적에 맞서 세계를 구한 대죄인들이 다시 집결한다.']
구원받은 도둑,관람객 평점 없음,['드라마'],미국,93분,2021.10.28,"['제이 지앤넌', '스텔리오 사반트']",12세 관람가,https://movie-phinf.pstatic.net/20211025_295/1635144523476p5bgo_JPEG/movie_image.jpg?type=m203_290_2,['어린 소년 디스마스는 어머니를 잃고 동생 요담과 함께 사막을 떠돌다 한 도적 무리를 만나 그들과 함께 오랜 시간을 도적질로 일생을 보내다. 어느 날 형제는 로마 군사에게 체포되어 죄값으로 죽음을 마주하고 함께 십자가에 못박힌 예수를 보며 위대한 고백을 하는데…']
케이지드,관람객 평점 없음,"['스릴러', '드라마', '공포', '범죄']",미국,80분,2021.11.11,"['에디 가테지', '멜로라 하든']",15세 관람가,https://movie-phinf.pstatic.net/20211103_62/1635915325328vK4D6_PNG/movie_image.jpg?type=m203_290_2,"['정신과 의사 할로우는 아내 앰버를 죽였다는 이유로 무기징역을 선고받고, 독방에 일주일 동안 수감된다. 악명높기로 소문난 색스 교도관은 할로우가 유죄라 확신하고 각종 이유로 할로우의 독방 생활 기간을 연장한다.', <br/>, '\xa0옆방 죄수의 자살과 길어지는 독방 생활 중에도 무죄를 확신하며 억울함을 호소하던 할로우는 자신이 몰랐던 아내의 죽음에 대한 어두운 진실이 있음을 알게 되고….', <br/>, '\xa0', <br/>, '\xa0최후의 순간! 그에게 주어진 시간은 단 1분.', <br/>, '\xa0과연 할로우는 그날의 진실을 마주할 수 있을까?']"
색다른 그녀,관람객 평점 없음,"['멜로/로맨스', '코미디']",한국,108분,2021.10.14,"['혁', '장성윤']",청소년 관람불가,https://movie-phinf.pstatic.net/20211001_27/1633064014267carNI_JPEG/movie_image.jpg?type=m203_290_2,"['여자친구 ‘지연’과 결혼을 앞둔 완벽남 ‘완준’', <br/>, '\xa0', <br/>, '\xa0‘완준’은 사고뭉치 선배로부터 받은 부탁으로', <br/>, '\xa0‘지연’에게도 말 못 할 은밀한 비밀을 갖게 된다.', <br/>, '\xa0', <br/>, '\xa0어느 날, ‘완준’은 ', <br/>, '\xa0자신을 짝사랑하는 직장동료 ‘예리’에게', <br/>, '\xa0이 사실을 들키게 되고,', <br/>, '\xa0그녀와 뜻밖의 계약을 맺게 되는데…', <br/>, '\xa0', <br/>, '\xa0갑자기 꼬여버린 인생!', <br/>, '\xa0무사히 결혼에 골인할 수 있을까?!']"
불청객들,관람객 평점 없음,"['공포', '액션']",러시아 연방,87분,2021.09.27,['15세 관람가'],['전체 관람가'],https://movie-phinf.pstatic.net/20210830_161/1630291252063xVnc9_JPEG/movie_image.jpg?type=m203_290_2,"['젊은 카티야는 다른 사람들의 빈 집에서 파티를 열면서 살고 있다. ', <br/>, '\xa0그러던 중 해안에 있는 오래된 여름 별장을 발견한다. ', <br/>, '\xa0지난 세기 초의 정신병원이기도 했던 이곳은 젊고 혈기 왕성한 파티 피플들에게 훌륭한 선택인 것 같다. ', <br/>, '\xa0하지만 파티 도중에 그 집의 신비한 주인이 나타나고 피할 수 없는 죽음이 찾아오는데…']"
바바 야가 검은 가시 마녀,관람객 평점 없음,"['공포', '액션']",러시아 연방,86분,2021.10.05,['15세 관람가'],['전체 관람가'],https://movie-phinf.pstatic.net/20210830_5/16302921253941NgYL_JPEG/movie_image.jpg?type=m203_290_2,"['세인트 페테스부르크 북쪽의 빽빽하고 불길한 검은 가시나무 숲. ', <br/>, '\xa0지난 30년 동안 수많은 사람들이 실종되었고 발견된 몇 구의 시체는 ', <br/>, '\xa0발가벗겨진 상태였다. ', <br/>, '\xa0지역 주민들은 가시 나무숲에 과거 잔혹하게 살해당한 검은 가시 마녀의 저주라고 믿고 있다. ', <br/>, '\xa02017년 10월 14일 산림 감시 자원봉사 팀은 실종된 10대를 찾기 위해 ', <br/>, '\xa0바로 그 숲으로 들어갔고 모든 의사소통이 끊겼다. ', <br/>, '\xa0생존을 위한 처절한 몸부림과 미지의 존재와의 사투가 피 말리는 공포와 함께 벌어진다.']"
F20,관람객 평점 9.50점,['스릴러'],한국,104분,2021.10.06,"['장영남', '김정영', '김강민']",15세 관람가,https://movie-phinf.pstatic.net/20210928_86/16327951839736fzkS_JPEG/movie_image.jpg?type=m203_290_2,"['어디에 내놔도 자랑스러운 아들을 둔 엄마 ‘애란’은', <br/>, '\xa0군 생활을 떠났던 아들 ‘도훈’에게', <br/>, '\xa0조현병이 발병했다는 충격적인 소식을 듣게 된다.', <br/>, '\xa0', <br/>, '\xa0완벽했던 자신의 일상을 빼앗길까 두려운 ‘애란’은', <br/>, '\xa0아들의 병을 숨긴 채 살아가기로 결심하고', <br/>, '\xa0', <br/>, '\xa0그러나, 순조로울 것만 같았던 그녀의 삶에', <br/>, '\xa0유일한 비밀을 알고 있는 ‘경화’가 나타나자', <br/>, '\xa0‘애란’의 불안은 점점 광기로 변해가는데…', <br/>, '\xa0', <br/>, '\xa0가장 날카롭고 충격적인 영화가 온다!']"
여대괴담,관람객 평점 없음,"['공포', '스릴러']",중국,88분,2021.09,"['전계문', '강호문']",15세 관람가,https://movie-phinf.pstatic.net/20210831_72/1630372947127FXtNk_JPEG/movie_image.jpg?type=m203_290_2,"['어릴 적 장애로 인해 언어치료사의 꿈을 갖고 있었던 이진흔은 대학 시험을 망치는 바람에 집에서 멀리 떨어진 외딴 대학 언어치료학과에 입학을 하게 된다. 기숙사 3층을 홀로 쓰게 된 진흔은 밤마다 계속되는 이상한 소리에 시달리는데... 그러던 어느 날 방에 숨어 들어온 유미라는 학생과 친구가 된다. 학교에서 만난 친구들은 모두가 까칠하게 굴었지만, 유미는 그들과 달리 진흔에게 살갑게 굴고 같이 시간을 보내면서 금세 친해진다. 그러나 학교에서는 계속 이상한 일들이 일어나고, 유미는 그때마다 진흔을 구해주는데...']"
우리가 죽기를 바라는 사람들,관람객 평점 없음,['스릴러'],미국,102분,2021.09,['시옵한 폴론'],['전체 관람가'],https://movie-phinf.pstatic.net/20210903_95/1630636189023FPfU2_JPEG/movie_image.jpg?type=m203_290_2,"['올해 대학에 입학한 첫째 아들 지미의 클럽 활동과 기상 시간까지 챙기는 바바라는 네 아이의 엄마다.\r', <br/>, '\xa0어느 날, 대학 클럽 신고식에서 지미가 사망하는 사고가 발생하지만 어느 누구도 책임지려 하지 않는다.\r', <br/>, '\xa0긴 시간을 침묵으로 기다린 바바라는 잠시 집안일을 미뤄 둔 채 지미를 위한 프로젝트를 시작하는데...']"
강릉,관람객 평점 8.36점,"['범죄', '액션']",한국,119분,2021.11.10,"['유오성', '장혁', '박성근']",청소년 관람불가,https://movie-phinf.pstatic.net/20211108_295/1636363035383sHbbs_JPEG/movie_image.jpg?type=m203_290_2,"['강릉 최대 조직의 ‘길석’\r', <br/>, '\xa0평화와 의리를 중요시하며 질서 있게 살아가던 그의 앞에\r', <br/>, '\xa0강릉 최대 리조트 소유권을 노린 남자 ‘민석’이 나타난다\r', <br/>, '\xa0\r', <br/>, '\xa0첫 만남부터 서늘한 분위기가 감도는 둘,\r', <br/>, '\xa0‘민석’이 자신의 목표를 위해 본격적으로 움직이기 시작하면서\r', <br/>, '\xa0두 조직 사이에는 겉잡을 수 없는 전쟁이 시작되는데..\r', <br/>, '\xa0\r', <br/>, '\xa0거친 운명 앞에 놓인 두 남자\r', <br/>, '\xa0그들의 이야기가 시작된다']"
뷰티풀 다크니스,관람객 평점 없음,"['드라마', '멜로/로맨스']",미국,93분,2021.09,"['섀넌 타벳', '에이단 터너', '벤자민 워커']",15세 관람가,https://movie-phinf.pstatic.net/20210818_26/1629264123119fRKBg_JPEG/movie_image.jpg?type=m203_290_2,"[""'선택적 지각 오류'라는 증상으로 살아 있는 어머니의 존재를 인식하지 못한 채 살고 있는 엘리자베스.\r"", <br/>, '\xa0어느 날, 남자친구이자 심리학자인 파머의 사무실에 갔다가\r', <br/>, '\xa0자신이 인식하지 못하는 또 다른 존재가 있다는 걸 알게 되면서 엘리자베스는 혼란에 빠지는데...']"
코만도 인 런던,관람객 평점 없음,"['액션', '모험']",인도,128분,['미상'],"['비드윳 잠왈', '아다 샤르마', '앙기라 다르']",15세 관람가,https://movie-phinf.pstatic.net/20210818_91/1629272135070oRWJA_JPEG/movie_image.jpg?type=m203_290_2,['알 수 없는 누군가가 그의 본거지인 영국에서 인도를 공격하기 위한 음모를 꾸미고 있다는 정황이 포착된다. 카란 싱 도그라는 영국 정보기관의 도움을 받아 이 미지의 적을 추적하기 위해 영국으로 떠난다. 과연 코만도는 테러를 막고 조국을 지킬 수 있을 것인가?']
위쳐: 늑대의 악몽,관람객 평점 없음,['애니메이션'],미국,82분,['미상'],['청소년 관람불가'],['전체 관람가'],https://movie-phinf.pstatic.net/20210908_248/1631063807988jYHAM_JPEG/movie_image.jpg?type=m203_290_2,"['가난에서 벗어나고 싶었다. 타고난 운명을 거부하려 했다. 스스로 위쳐의 길을 택한 베스미어, 돈을 위해 괴물을 사냥하는 사내. 하지만 알 수 없는 위협과 더불어 과거의 어둠이 그를 덮친다.']"
블랙 아일랜드,관람객 평점 없음,"['미스터리', '스릴러', '드라마']",독일,104분,['미상'],"['앨리스 드바이어', '한스 지쉴러']",청소년 관람불가,https://movie-phinf.pstatic.net/20210908_104/1631063600577DQ0sw_JPEG/movie_image.jpg?type=m203_290_2,['부모를 잃은 뒤 할아버지와 함께 살게 된 요나스가 어느 날 섬으로 이사 온 교사와 가까운 관계가 되면서 할아버지의 어두운 과거를 알게 되고 평화로 왔던 섬마을에 복수극이 펼쳐지는 이야기']
극장판 마이 리틀 포니: 새로운 희망,관람객 평점 없음,"['애니메이션', '모험']",미국,90분,2021.09.22,"['제인 크라코스키', '바네사 허진스', '제임스 마스던']",전체 관람가,https://movie-phinf.pstatic.net/20210902_69/1630551063783FBxOi_JPEG/movie_image.jpg?type=m203_290_2,"['포니, 페가수스, 유니콘이 함께 조화를 이루며 살던 이퀘스트리아.\r', <br/>, '\xa0하지만 평화가 사라져버린 그곳, 신비로운 마법의 힘마저 잃었다.\r', <br/>, '\xa0\r', <br/>, '\xa0예전처럼 모두가 친구가 될 수 있다고 믿는 어스 포니 ‘써니’에게\r', <br/>, '\xa0신비한 뿔을 가진 유니콘 ‘이지’가 나타나고, 운명처럼 친구가 된 둘은\r', <br/>, '\xa0잃어버린 이퀘스트리아의 마법과 우정을 되찾기 위해 머나먼 모험을 떠나는데…\r', <br/>, '\xa0\r', <br/>, '\xa0과연, 친구들은 사라진 마법의 힘을 되찾을 수 있을까?\r', <br/>, '\xa0\r', <br/>, '\xa0거대한 세계를 뒤바꿀 작은 포니들의 새로운 모험이 시작된다!']"
