전쟁,관람객 평점 없음,"['액션', '모험', '스릴러']",미국,91분,2020.12.30,"['가이 피어스', '데본 사와', '브랜스콤비 리치몬드']",15세 관람가,https://movie-phinf.pstatic.net/20201102_248/1604308917066pVlj9_JPEG/movie_image.jpg?type=m203_290_2,"['미국 남부의 작은 마을 호스 케이브\r', <br/>, '\xa0과거 자신의 실수로 동료를 잃었다고 생각하며 트라우마를 안고 살아가는 보안관 ‘짐 딜런’은\r', <br/>, '\xa0은행털이 강도단과 서로의 목적을 향해 사투를 벌인다. \r', <br/>, '\xa0\r', <br/>, '\xa0강도단은 사전에 철저한 계획을 세운 뒤 마을을 봉쇄하고 \r', <br/>, '\xa0호스 케이브를 지키려는 마을 사람들을 향해 무자비한 총격을 가한다. \r', <br/>, '\xa0강도단은 최종 목표물인 현금 수송차까지 손에 넣게 되고 \r', <br/>, '\xa0‘짐’과 신참 보안관 ‘맷’은 서로 다른 위치에서 마을을 구할 작전을 펼치게 되는데..\r', <br/>, '\xa0\r', <br/>, '\xa0호스 케이브를 살릴 수 있는 마지막 기회!\r', <br/>, '\xa0보안관과 강도단의 목숨을 건 사투가 벌어진다!']"
레전더리 콘서트: 카를로스 클라이버,관람객 평점 없음,['공연실황'],독일,75분,2020.12.02,['전체 관람가'],['전체 관람가'],https://movie-phinf.pstatic.net/20201222_268/1608600226838v0XRW_JPEG/movie_image.jpg?type=m203_290_2,"['음악가들의 음악가, 카를로스 클라이버가 지휘하는 빈 필하모닉의 공연 실황이다. 마에스트로 클라이버는 특유의 완벽주의로 인해 레퍼토리가 극히 제한적이었지만 항상 최상의 연주를 들려준 것으로 유명하다. 소수의 음반과 영상만을 남긴 그의 공연을 감상할 수 있는 흔치 않은 기회이자 빈 필하모닉과의 앙상블이 최고조에 달했던 순간을 포착한 역사적 기록이다.', <br/>, '\xa0연주 작품은 모차르트의 천재성을 가늠하게 하는 교향곡 제36번 ‘린츠’와 복잡한 구조와 주제 의식으로 유명한 브람스 교향곡 제2번이다. 서정적인 작품을 지휘하는 클라이버의 유연하면서도 격렬한 모습은 인상적이며 엄청난 오케스트라 장악력을 느낄 수 있다. 디지털 5.1 서라운드 사운드로 복원되어 현장감을 생생하게 전한다.']"
인플루언서,관람객 평점 없음,['다큐멘터리'],한국,106분,2020.11.25,"['이유빈', '지윤미', '강지혜']",전체 관람가,https://movie-phinf.pstatic.net/20201116_214/1605517130119RvpcN_JPEG/movie_image.jpg?type=m203_290_2,"['그들의 팔로워 구독자를 합하면 무려 100만명이 넘는다!!\r', <br/>, '\xa0각자의 분야에서 대한민국을 대표하는 4명의 인플루언서들이 한자리에 모였다!\r', <br/>, '\xa0\r', <br/>, '\xa0인스타그램 팔로워 20만명!\r', <br/>, '\xa0한 아이의 엄마이자, 요즘 잘나가는 화장품 브랜드의 대표인 대한민국의 슈퍼 워킹맘!\r', <br/>, '\xa0이유빈.\r', <br/>, '\xa0\r', <br/>, '\xa0인스타그램 팔로워 21만명!\r', <br/>, '\xa0밝고 털털한 성격과 구수한 사투리의 입담으로 친근한 언니 같지만\r', <br/>, '\xa0헤어디자이너 분야에선 카리스마 넘치는 프로페셔널한 그녀!\r', <br/>, '\xa0강지혜.\r', <br/>, '\xa0\r', <br/>, '\xa0인스타그램 팔로워 40만 명!\r', <br/>, '\xa0과거 얼짱시대 방송으로 데뷔한 이후,\r', <br/>, '\xa0대중들에게 많은 관심을 쏟아내며, 머리부터 발끝까지 스타일리쉬한 매력넘치는 그녀!\r', <br/>, '\xa0지윤미.\r', <br/>, '\xa0\r', <br/>, '\xa0유튜브 구독자 30만 명!\r', <br/>, '\xa0남자들의 형님! 남자들의 워너비!\r', <br/>, '\xa0터미네이터 같은 근육질 몸매와 야생마 같은 마초의 매력을 지닌 무자비한 그 남자!\r', <br/>, '\xa0야생마(본명 : 주경진)\r', <br/>, '\xa0\r', <br/>, '\xa0강한 이미지에 화려하게만 보이는 그들의 외적인 모습 보다는,\r', <br/>, '\xa0따뜻하고 사랑 넘치는 그들의 내면의 모습을 보고 나면 그들의 매력에 점점 더 빠져 든다!']"
뱅가드,관람객 평점 10.00점,['액션'],중국,108분,2020.12.30,"['성룡', '양양']",12세 관람가,https://movie-phinf.pstatic.net/20201209_179/1607477160670HUpEC_JPEG/movie_image.jpg?type=m203_290_2,"['‘탕환팅’(성룡)이 이끄는 국제 민간 경호업체 뱅가드.\r', <br/>, '\xa0새해 축제가 한창인 런던 한복판에서 VIP 고객이 범죄 조직에 납치되고\r', <br/>, '\xa0뱅가드는 그를 구출하는데 성공한다. \r', <br/>, '\xa0\r', <br/>, '\xa0이에 분노한 범죄 조직은 VIP 고객의 딸을 새로운 타깃으로 삼고,\r', <br/>, '\xa0그들보다 먼저 아프리카에 있는 그녀를 찾아 보호하는 과정에서\r', <br/>, '\xa0뱅가드의 팀원 ‘레이전위’(양양)가 위험에 처한다.\r', <br/>, '\xa0\r', <br/>, '\xa0두바이로 넘어가 구출 작전을 펼치던 뱅가드는\r', <br/>, '\xa0거대한 배후 세력의 음모와 마주하게 되는데…']"
스페셜 솔져,관람객 평점 없음,['액션'],폴란드,86분,2020.12,"['딜런 부르스', '세르게이 바드육']",15세 관람가,https://movie-phinf.pstatic.net/20201106_150/1604643359025U9n4e_JPEG/movie_image.jpg?type=m203_290_2,"['임무를 수행하던 중 팀원을 잃은 ‘존 카터’\r', <br/>, '\xa0마음에 상처를 안고 전역한 그에게 상사였던 ‘앤더슨 소장’이 나타난다. \r', <br/>, '\xa0다시 한번 원수를 만날 기회를 제안하고, \r', <br/>, '\xa0새로운 임무와 새로운 팀원들을 다시 만나게 되는데..\r', <br/>, '\xa0\r', <br/>, '\xa0‘존 카터’는 이번엔 기필코 팀원만큼은 무사 귀환을 다짐한다.\r', <br/>, '\xa0임무 수행 중 결국 ‘이고르 로딘’과 맞닥뜨리게 되고, \r', <br/>, '\xa0그동안 숨겨왔던 비밀이 하나둘 드러나기 시작하는데..']"
스트레스 제로,관람객 평점 9.00점,['애니메이션'],한국,93분,2021.02.03,"['임채헌', '유동균', '김승태']",전체 관람가,https://movie-phinf.pstatic.net/20210114_245/1610613719280OTa9h_JPEG/movie_image.jpg?type=m203_290_2,"['어느 날 도심 곳곳에 정체를 알 수 없는 거대한 불괴물이 나타나 대한민국은 혼란에 빠진다.\r', <br/>, '\xa0불괴물의 습격으로 졸지에 직장을 잃은 짱돌은 친구 고박사, 타조와 함께\r', <br/>, '\xa0‘스트레스 제로’를 팔아 백수 탈출을 하고자 하지만,\r', <br/>, '\xa0이 음료가 바로 불괴물을 막을 수 있는 유일한 비밀임을 알게 되는데..!\r', <br/>, '\xa0갑자기 히어로가 된 아빠 짱돌과 친구들은 과연 불괴물을 잡고, 세상을 구할 수 있을까?']"
바바 야가: 숲의 악령,관람객 평점 없음,['공포'],러시아 연방,96분,2021.02.18,['15세 관람가'],['전체 관람가'],https://movie-phinf.pstatic.net/20210111_297/1610333075391MB9qR_JPEG/movie_image.jpg?type=m203_290_2,"['특별한 기운을 느끼는 소년 “예고르”', <br/>, '\xa0새로 온 유모의 수상한 행동을 알아챈다.', <br/>, '\xa0여동생이 사라지고 부모님은 동생을 기억조차 못한다.', <br/>, '\xa0마을 아이들이 하나씩 사라지고, 단서를 추적하기 시작하는데…', <br/>, '\xa0마침내 전설 속 슬라브 마녀가 존재를 나타낸다.', <br/>, '\xa0', <br/>, '\xa0모든 기억이 사라지기 전에 반드시 아이들을 찾아야 한다!']"
노바디 ,관람객 평점 8.16점,"['액션', '코미디']",미국,91분,2021.04.07,['밥 오덴커크'],15세 관람가,https://movie-phinf.pstatic.net/20210412_226/1618192532740Fjxab_JPEG/movie_image.jpg?type=m203_290_2,"['비범한 과거를 숨긴 채 남들과 다를 바 없는 평범한 일상을 사는 한 가정의 가장 ‘허치’\r', <br/>, '\xa0매일 출근을 하고, 분리수거를 하고 일과 가정 모두 나름 최선을 다하지만\r', <br/>, '\xa0아들한테는 무시당하고 아내와의 관계도 소원하다.\r', <br/>, '\xa0그러던 어느 날, 집안에 강도가 들고 허치는 한 번의 반항도 하지 못하고 당한다.\r', <br/>, '\xa0더 큰 위험으로부터 가족을 지키기 위한 선택이었는데 모두 무능력하다고 ‘허치’를 비난하고,\r', <br/>, '\xa0결국 그동안 참고 억눌렀던 분노가 폭발하고 만다.']"
마리오네트,관람객 평점 9.00점,"['미스터리', '스릴러']",네덜란드,112분,2021.02.17,"['테크라 레우텐', '피터 뮬란', '엘리야 울프']",12세 관람가,https://movie-phinf.pstatic.net/20210208_76/1612753603398OGM0m_JPEG/movie_image.jpg?type=m203_290_2,"['아동 심리치료사 메리언은\r', <br/>, '\xa0매니라는 특별한 9살 소년을 돌보게 된다.\r', <br/>, '\xa0\r', <br/>, '\xa0항상 말없이 그림만 그리던 매니는\r', <br/>, '\xa0계속된 메리언의 관심에\r', <br/>, '\xa0자신이 미래를 통제할 수 있다고 말한다.\r', <br/>, '\xa0\r', <br/>, '\xa0매니를 믿지 않았던 메리언 앞에\r', <br/>, '\xa0매니가 그린 그림들이 하나 둘 현실이 되자,\r', <br/>, '\xa0그녀는 모두가 감춘 소년의 비밀을 파헤치기 시작하는데…']"
런 런 런,관람객 평점 없음,['공포'],미국,72분,2020.12,"['젬마 할로 딘', '라이언 길크스']",15세 관람가,https://movie-phinf.pstatic.net/20201126_92/1606375785960mSuE5_JPEG/movie_image.jpg?type=m203_290_2,"[""범죄 조직의 운반책 '코먼'은 어느 날, 의문의 사람에게 중요한 가방을 전달하라는 임무를 받는다.\r"", <br/>, '\xa0코먼은 수갑으로 팔과 가방이 연결된 채 파트너인 지미의 차를 타고 목적지로 가던 길에 허허벌판에서 차량이 전복되는 큰 사고를 당한다.\r', <br/>, '\xa0정신을 차려 보니 지미는 사망했고, 코먼은 한쪽 다리가 차 밑에 깔려 옴짝달싹할 수가 없다.\r', <br/>, '\xa0바로 그때, 코먼의 손목에 연결된 가방을 노리는 범죄 조직이 거리를 점점 좁혀 오고\r', <br/>, '\xa0설상가상으로 숲속 깊은 곳에서는 정체를 알 수 없는 괴물이 코먼을 위협하는데...']"
콜: 사라진 여자들,관람객 평점 없음,['스릴러'],미국,84분,2020.12,['15세 관람가'],['전체 관람가'],https://movie-phinf.pstatic.net/20201204_18/1607068093870oGtNA_JPEG/movie_image.jpg?type=m203_290_2,"['형편없는 데이트를 끝내고 술에 취한 밀리.\r', <br/>, '\xa0깨어나 보니 밀리는 낯선 장소의 의자에 결박되어 있다.\r', <br/>, '\xa0밀리를 납치한 남자는 마스크로 얼굴을 가린 채 자신을 사랑하라는 말도 안 되는 요구를 한다.\r', <br/>, '\xa0그러던 중 의문의 여자가 밀리에게 도움을 손길을 내미는데...']"
누군가 어디에서 나를 기다리면 좋겠다,관람객 평점 7.57점,"['드라마', '가족']",프랑스,89분,2020.12.17,"['장 폴 루브', '앨리스 태그리오니', '벤자민 라베른헤']",15세 관람가,https://movie-phinf.pstatic.net/20201120_105/1605838123836kSDkk_JPEG/movie_image.jpg?type=m203_290_2,"['아버지의 죽음 후 엄마와 함께 동생들까지 돌보면서, 세일즈맨으로도 성공한 삶을 살고 있는 ‘장피에르’. 어느 날 우연히 첫사랑 ‘헬레나’의 소식을 듣게 되고, 함께 배우를 꿈꾸며 연극 무대에서 공연을 했던 젊은 시절을 추억하며 버려진 과거의 꿈, 지나가 버린 시간과 마주하게 된다.\r', <br/>, '\xa0\r', <br/>, '\xa0‘장피에르’가 이처럼 인생 중 최고의 무기력함을 느끼고 있을 때, 40세에 첫 임신을 하게 되어 들뜬 나날을 보내는 작가 지망생 ‘쥘리에트’, 직장 동료를 짝사랑하고 있지만 소심해서 고백을 못 하고 있는 ‘마티유’, 그리고 진정한 아티스트가 되고자 하는 사진작가 ‘마고’까지 우애 깊은 4남매는 크리스마스이브 파티를 위해 어머니가 살고 있는 브루고뉴 본가에 모두 모이게 된다. 하지만 함께 즐거운 시간을 보내던 중 사소한 다툼으로 시작된 작은 균열은 모두의 삶에 큰 변화를 가져다주게 되는데…']"
크루아상,관람객 평점 9.80점,['드라마'],한국,78분,2021.01.21,"['남보라', '혁']",12세 관람가,https://movie-phinf.pstatic.net/20201223_115/1608705718079XOL5g_JPEG/movie_image.jpg?type=m203_290_2,"['사회 초년생 시절 취업하는 회사마다 페업의 불운을 겪었던 희준은 더 이상 다니는 직장의 폐업을 걱정하지 않아도 될 공무원이 되기 위해 몇 년째 고군분투 중이다. 생동성 실험 아르바이트로 생계를 이어가며 담당 간호사인 윤정만이 건조한 일상에 단비 같은 존재일 뿐이던 희준은 어느 날, 동네 빵집 주인 성은을 알게 된다. 성은은 희준이 그토록 원하는 공무원이었음에도 적성에 맞지 않아 직장을 그만두고, 파티셰가 되어 작은 빵집을 차렸다. ', <br/>, '\xa0', <br/>, '\xa0생동성 실험을 위해 병원에 있었던 희준은 어느 날 밤, 병원 응급실에 혼자 오게 된 성은을 도와주게 되고, 성은의 빵집 아르바이트로 일을 하게 된다. 어느새 성은이 만든 빵의 맛과 제빵 과정에 호기심을 느끼게 된 희준은 시험공부를 하는 시간보다, 성은의 작업실에서 함께 빵을 만드는 시간이 더 많아지게 되는데..']"
골든맨,관람객 평점 6.00점,"['범죄', '드라마']",이탈리아,104분,2021.01.27,"['지암파올로 모렐리', '파비오 드 루이지', '에도아도 레오']",15세 관람가,https://movie-phinf.pstatic.net/20210112_84/1610414549103EvNE5_JPEG/movie_image.jpg?type=m203_290_2,"['지긋지긋한 생활에서 벗어나 한탕만을 노리는 우체국 운전사 ‘메로니’\r', <br/>, '\xa0가난의 늪에 허덕이며 아득바득 성질을 죽이며 사는 집배원 ‘자고’\r', <br/>, '\xa0퇴물로 전락한 밑바닥 인생의 전직 복싱 선수 ‘니콜라’(a.k.a ‘울프’)\r', <br/>, '\xa0\r', <br/>, '\xa0마지막 한탕을 노린 완전범죄를 계획한 그들은\r', <br/>, '\xa0서로 다른 속내를 숨긴 채 한배에 올라타게 되는데…']"
족벌 두 신문 이야기,관람객 평점 9.93점,['다큐멘터리'],한국,168분,2021.01.01,['12세 관람가'],['전체 관람가'],https://movie-phinf.pstatic.net/20201229_116/1609228460317kraKD_JPEG/movie_image.jpg?type=m203_290_2,"['앞잡이', <br/>, '\xa01985년 동아일보와 조선일보는 느닷없이 ‘친일 공방’을 벌인다. 누가 더 ‘친일지’고 ‘민족지’인지 다투는 이전투구였다. 두 신문이 한사코 감추려 한 ‘일제의 앞잡이’ 역사를 추적한다.', <br/>, '\xa0', <br/>, '\xa0밤의 대통령', <br/>, '\xa0일제가 가고 두 신문 앞에 새로운 권력이 나타났다. 이들은 박정희, 전두환 군부 독재 정권에 굴복하고, 유착하면서 그 대가로 덩치를 키워 소위 ‘밤의 대통령’이라고 불린 영향력을 행사했다. 반면 권력과 사주에 맞서 자유언론을 지키려던 두 신문 소속 언론인 수백 명은 차디찬 거리로 쫓겨났다.', <br/>, '\xa0', <br/>, '\xa0악의 축', <br/>, '\xa01987년 민주화 이후 확보된 언론 자유의 공간이 아이러니하게 족벌신문 사주에게 날개를 달아줬다. 두 족벌은 정관계 및 재벌과 인맥, 혼맥으로 이어진 거대한 네트워크를 구축하고 종편 등 수십 개 계열사를 거느리며 ‘불가사리’ 같은 권력이 됐다. 대통령 노무현은 언론개혁을 시도했으나 거대 기득권 언론 앞에 작고 외로운 섬일 뿐이었다. 두 족벌 미디어 기업은 ‘특판’, ‘기사형 광고’, ‘반사회적 광고’ 물량에서도 1, 2위를 다툰다. 이들은 4대, 5대 세습을 하며, 2020년 창간 100주년을 맞아 ‘진실의 수호자’. ‘더 나은 100년’을 외친다.']"
레컨,관람객 평점 없음,"['전쟁', '액션']",미국,95분,2021.02.25,"['알렉산더 루드윅', '프랑코 네로', '샘 킬리']",15세 관람가,https://movie-phinf.pstatic.net/20210208_112/1612748791504bs9H4_JPEG/movie_image.jpg?type=m203_290_2,"['2차 세계대전이 끝나갈 무렵\r', <br/>, '\xa0마지막 임무를 위해 전진하는 부대원들에게\r', <br/>, '\xa0매복, 저격수 그리고 지뢰가 기다린다.\r', <br/>, '\xa0산 위에 주둔한 독일군을 정찰하는 부대원들은\r', <br/>, '\xa0자실 임무인 것을 깨닫고, 마지막 전투를 준비하는데…']"
배틀로얄 : 매드랜드,관람객 평점 없음,"['액션', '스릴러']",일본,97분,2021.06.24,['아사카와 나나'],15세 관람가,https://movie-phinf.pstatic.net/20210121_275/16111932435455hQQy_JPEG/movie_image.jpg?type=m203_290_2,"['다시 시작된 죽음의 생존 게임.', <br/>, '\xa0살기 위해 친구를 죽여야 하는 생존 게임에서', <br/>, '\xa0모에는 최대한 친구들을 희생 시키 않으려 노력한다.', <br/>, '\xa0하지만 결국 모에는 타깃이 되어 죽음의 위기에 처한다.', <br/>, '\xa0하지만 마지막 순간,', <br/>, '\xa0모에는 모두를 깜짝 놀라게 할 선택을 하는데…']"
반딧불이 딘딘과 용감한 곤충 탐험대,관람객 평점 6.00점,['애니메이션'],중국,86분,2021.03.25,['전체 관람가'],['전체 관람가'],https://movie-phinf.pstatic.net/20210225_212/1614230200527IKqmQ_JPEG/movie_image.jpg?type=m203_290_2,"['숲속 마을 친구들이 위험에 빠지면 언제나 나타나는 용감한 반딧불이 딘딘과 숲속 탐험대.\r', <br/>, '\xa0탐사 로봇 오로라가 우주에서 가져온 최첨단 신호등은 숲속 친구들 사이에서 인기 만발이다.\r', <br/>, '\xa0\r', <br/>, '\xa0하지만 불빛을 위협 신호로 받아들이는 나방 부족 추장은 딘딘과 친구들을 공격하고,\r', <br/>, '\xa0외계 행성에서 나타난 붉은 로봇 군단이 숲속 마을 친구들을 모두 잡아가려 하는데…\r', <br/>, '\xa0과연 딘딘과 친구들은 무사할 수 있을까?\r', <br/>, '\xa0\r', <br/>, '\xa0반딧불이 딘딘과 곤충 탐험대의 빛나는 모험이 시작된다!']"
토이 솔져스: 가짜사나이2 더 컴플리트,관람객 평점 없음,['다큐멘터리'],한국,112분,2021.01.27,"['김병지', '줄리엔 강', '힘의길']",15세 관람가,https://movie-phinf.pstatic.net/20210119_74/1611022473600mjTT8_JPEG/movie_image.jpg?type=m203_290_2,"['“할 수 있어! 극복해!”', <br/>, '\xa0', <br/>, '\xa0가짜가 대세인 현실세계에 진솔한 모습을 통해 ‘진짜’를 보여주며 공명하고 있는 리얼 버라이어티 콘텐츠인 가짜사나이2 극장판, ‘토이 솔져스’가 손바닥만한 화면에서 벗어나, 스크린을 통해 보다 리얼하게 관객에게 다가간다.']"
레전더리 콘서트: 레너드 번스타인,관람객 평점 없음,['공연실황'],독일,78분,2021.01.01,['귀네스 존스'],전체 관람가,https://movie-phinf.pstatic.net/20201222_43/1608601152351q57fd_JPEG/movie_image.jpg?type=m203_290_2,"['레너드 번스타인은 경계 없는 음악의 자유인이었다. 뉴욕 필하모닉 최연소 음악 감독에 임명되며 당대 최고의 지휘자 자리에 올랐고 ‘청소년 음악회’를 통해 클래식 음악의 미래 저변을 확장했다. 큰 인기를 끈 뮤지컬 ‘웨스트 사이드 스토리’를 작곡하는 등 전방위적인 예술 활동을 펼치며 가장 미국적인 음악가로서 새로운 전형을 제시했다. 이번 공연 실황은 번스타인이 활동 무대를 유럽으로 확장해 빈 필하모닉을 지휘하며 말년의 원숙미를 더하던 모습을 담아낸 기록이다.', <br/>, '\xa0연주되는 베토벤 교향곡 제9번 ‘합창’은 청력을 완전히 잃은 작곡가가 남긴 마지막 교향곡이자 고전주의를 완성하는 최고의 걸작으로 꼽힌다. 디지털 5.1 서라운드 사운드로 복원되어 환희와 인류애의 메시지가 생생히 울려 퍼지는 벅찬 대화합의 무대에서 번스타인은 음악이 세상을 자유롭게 할 것이라고 당당히 선언한다.']"
CCTV,관람객 평점 9.60점,['공포'],한국,99분,2021.07.07,"['곽도원', '김단미', '박기륭']",15세 관람가,https://movie-phinf.pstatic.net/20210727_176/1627361692878ljB5q_JPEG/movie_image.jpg?type=m203_290_2,"['일명 `CCTV 살인사건`. ', <br/>, '\xa010년 전. 8명이 죽고 1명이 행방불명이 된 전대미문의 살인극. ', <br/>, '\xa0바로 이 끔찍한 살인사건의 유일한 생존자를 유튜버가 찾아간다. ', <br/>, '\xa0유튜브 채널의 획기적인 조회수와 구독자 증가를 가져올 생존자와의 인터뷰가 시작되자... ', <br/>, '\xa010년 동안 숨겨졌던 끔찍한 사실이 드러나고,', <br/>, '\xa0아직도 끝나지 않았던 복수가 10년 만에 마무리 되는데...', <br/>, '\xa0', <br/>, '\xa0죽음을 부르는 눈동자, CCTV의 공포가 드러난다.']"
서바이브 더 나잇,관람객 평점 없음,"['액션', '스릴러']",미국,90분,2021.02.03,"['브루스 윌리스', '채드 마이클 머레이']",15세 관람가,https://movie-phinf.pstatic.net/20210121_251/1611207902439ym6ME_JPEG/movie_image.jpg?type=m203_290_2,"['의료 사고로 파산한 의사 ‘리치’(채드 마이클 머레이)는\r', <br/>, '\xa0아내와 딸을 데리고 부모님이 살고 있는 농장으로 돌아온다.\r', <br/>, '\xa0누나의 도움으로 마을 병원에 일자리를 얻지만\r', <br/>, '\xa0아버지 ‘프랭크’(브루스 윌리스)와의 사이는 냉랭하기만 하다.\r', <br/>, '\xa0\r', <br/>, '\xa0한편, ‘제이미’와 ‘매트’ 형제는 사람을 죽이고 거금을 훔쳐 멕시코로 도망 중이다.\r', <br/>, '\xa0잠시 들른 휴게소에서 충동적으로 싸움에 휘말린 결과로\r', <br/>, '\xa0‘매트’가 심한 부상을 입게 된다.\r', <br/>, '\xa0‘매트’를 위해 마을 병원을 찾은 ‘제이미’는 우연히 마주친 ‘리치’를 미행하고,\r', <br/>, '\xa0그의 집에 쳐들어가 가족들을 인질로 잡고 형을 치료하라고 협박한다.\r', <br/>, '\xa0\r', <br/>, '\xa0가족들을 안전하게 보호하기 위해\r', <br/>, '\xa0범죄자인 ‘매트’를 치료해야만 하는 ‘리치는’ 고민에 빠지고\r', <br/>, '\xa0평생 범죄자를 상대해오며 어차피 치료를 해도\r', <br/>, '\xa0이들이 가족을 살려 둘 리 없음을 잘 아는 전직 보안관 ‘프랭크’는 반격을 노리는데…\r', <br/>, '\xa0\r', <br/>, '\xa0잔인하기만 했던 그날 밤, 과연 이들은 살아남을 수 있을까?']"
게임의 법칙: 인간사냥,관람객 평점 6.00점,['스릴러'],한국,84분,2021.01.28,"['김성수', '조경훈', '서영']",청소년 관람불가,https://movie-phinf.pstatic.net/20210125_242/16115429890056J44a_JPEG/movie_image.jpg?type=m203_290_2,"['비밀스러운 과거를 간직한 ‘정환’,', <br/>, '\xa0과거를 정리하기 위해 찾아간 외딴섬에서 또 다른 여행객들과 마주하게 된다.', <br/>, '\xa0', <br/>, '\xa0모두 함께 머물게 된 게스트하우스에서', <br/>, '\xa0‘정환’ 홀로 묘한 분위기를 느끼고 주인 남자를 경계하지만', <br/>, '\xa0어느새 그들의 표적이 된 자신을 발견하게 된다.', <br/>, '\xa0', <br/>, '\xa0위험한 상황에서 가까스로 탈출하는 데 성공한 순간', <br/>, '\xa0또 다른 의문의 존재와 맞서 필사의 사투를 벌이게 되는데…', <br/>, '\xa0', <br/>, '\xa0섬의 위험한 비밀을 파헤치는 순간,', <br/>, '\xa0광기의 추격이 시작된다!']"
어처구니 없는,관람객 평점 없음,"['미스터리', '코미디']",푸에르토리코,91분,2021.04.22,['데니스 키노네스'],15세 관람가,https://movie-phinf.pstatic.net/20210323_25/1616468061183whrg6_JPEG/movie_image.jpg?type=m203_290_2,"['사고로 아버지를 잃은 트라우마로', <br/>, '\xa0혈액공포증을 앓는 보철 의료기 제작사 ‘마르코’.', <br/>, '\xa0', <br/>, '\xa0어느 날 그의 실수로 삼촌 ‘아귀레’가 죽고', <br/>, '\xa0패닉에 빠진 ‘마르코’는 사건을 감추려 하지만', <br/>, '\xa0흔적 없이 사라진 ‘아귀레’에 대해 의문을 품은 이들로 인해', <br/>, '\xa0조용하던 ‘마르코’의 일상은 완전히 뒤집힌다.', <br/>, '\xa0', <br/>, '\xa0예상치 못한 변수 ‘애나’까지 나타나면서', <br/>, '\xa0완벽한 범죄를 꿈꾸던 ‘마르코’의 모든 계획이 어긋나는데..', <br/>, '\xa0', <br/>, '\xa0예상보다 이상하고, 상상보다 훨씬 더 비범한 이야기', <br/>, '\xa0오늘 난 완전 범죄를 꿈꾼다!']"
칙 파이트,관람객 평점 없음,"['드라마', '액션', '코미디']",미국,97분,2021.02.04,"['말린 애커맨', '벨라 손', '알렉 볼드윈']",15세 관람가,https://movie-phinf.pstatic.net/20210118_170/1610945666482UGC3d_JPEG/movie_image.jpg?type=m203_290_2,"['되는 일 없이 점점 꼬여만 가는 인생이 답답한 플로리다의 싱글녀 ‘애나’.', <br/>, '\xa0그녀의 절친은 자신감을 되찾아야 할 때라며 ‘애나’를 여성 전용 파이트 클럽으로 데려간다.', <br/>, '\xa0', <br/>, '\xa0싸워본 적도 없고 싸우는 것도 싫은 그녀는 얼떨결에 클럽의 일원이 되고', <br/>, '\xa0어느 날, 무소불위 강자 ‘올리비아’가 자존심을 건드리자 충동적으로 결투를 신청하는데…', <br/>, '\xa0', <br/>, '\xa0언니들의 미친 맞짱이 시작된다!']"
