,title,vote,country,time,open_date,grade,poster_path,genre_1,genre_2,genre_3,genre_4,actor_1,actor_2,actor_3,content
1,왕십리 김종분,관람객 평점 없음,한국,102분,2021.11.11,12세 관람가,https://movie-phinf.pstatic.net/20211026_135/16352352904529aeAA_JPEG/movie_image.jpg?type=m203_290_2,다큐멘터리,,,,김종분, 김귀임, 김종수,"50년 넘게 노점을 해온 팔순의 김종분.', <br/>왕십리역 11번 출구 터줏대감이자 현역이다.', <br/>', <br/>자식 먹이고 입히고 공부시키려고 시작한 일인데,', <br/>자식 거둘 일 없어진 지금도 그곳을 지키고 있다.', <br/>30년 전 길 위에서 딸을 잃었지만, 더 많은 자식들을 얻었다.', <br/>', <br/>종분 씨는 딸 잃은 길 위에서', <br/>옥수수를 삶고, 가래떡을 굽고, 깻잎을 갠다.', <br/>오늘을 산다."
2,결혼 후에 남겨진 것들,관람객 평점 없음,미국,97분,2021.1,전체 관람가,https://movie-phinf.pstatic.net/20210928_272/1632791807061fiSix_JPEG/movie_image.jpg?type=m203_290_2,멜로/로맨스, 드라마,,,로스 맥콜, 앨리슨 밀러,,"10년 된 부부 라이언과 클로디아는 옛 추억을 떠올리며, 신혼여행지 이탈리아를 다시 찾는다.<br/>두 사람은 아름다운 풍경 속에서 함께 시간을 보내며, 오랜 결혼 생활로 잃어버린 무언가를 되찾으려 한다.<br/>하지만 클로디아가 다른 남자에게 쓴 연애편지를 라이언이 언급하면서 두 사람 사이의 갈등은 더욱 깊어지는데..."
5,피어썸,관람객 평점 없음,한국,82분,2021.10.07,15세 관람가,https://movie-phinf.pstatic.net/20210917_247/1631854202877hx03Y_JPEG/movie_image.jpg?type=m203_290_2,공포, 미스터리,,,조동혁, 차선우,,"공연을 할 수 없게 된 ‘승연’(조동혁)의 밴드는', <br/>재정비를 위해 춘천으로 떠나고,', <br/>우연히 그곳 클럽에서 멋진 실력을 보여준 그들은', <br/>정식 공연 제안과, 멋진 숙소까지 제공받게 된다.', <br/>', <br/>하지만 휴식도 잠시 기타리스트 ‘재혁’(차선우)이', <br/>뭔가에 홀린 듯 점점 섬뜩한 행동을 하기 시작하고,', <br/>곧 이 집에 자신들만 있는 게 아니라는 사실을 알게 되는데…"
6,피치 오브 타임 극장판,관람객 평점 없음,한국,99분,2021.10.21,12세 관람가,https://movie-phinf.pstatic.net/20210930_277/1632967172071mdLTA_JPEG/movie_image.jpg?type=m203_290_2,멜로/로맨스, 드라마,,,지미 칸 크리사나판, 최재현, 토미 싯티촉 푸에크풀폴,"친구 윤오의 연락을 받고 한국에 도착한 피치.', <br/>그렇게 날 반갑게 맞아준 윤오가 사실은 귀신이라고?!', <br/>25년째 한국을 떠나지 못하는 떠돌이 태국 귀신 마리오를 만난 피치는', <br/>윤오가 자신이 죽었다는 사실도 모른 채 지박령이 되었다는 걸 알게 된다.', <br/>악귀가 되지 않고 무사히 환생하려면', <br/>죽은 날로부터 49일안에 이승에서 풀지 못한 한을 풀어야 한다!', <br/>도대체 윤오가 그토록 원하던 일이 무엇이었을까?', <br/>함께 버킷리스트를 찾아가면서', <br/>서로를 향한 마음은 점점 커져가고 이별의 시간이 다가오는데…"
8,레드 아워,관람객 평점 없음,미국,93분,2021.1,15세 관람가,https://movie-phinf.pstatic.net/20210923_101/1632377012095mnKGS_JPEG/movie_image.jpg?type=m203_290_2,액션, 스릴러,,,타이레스 깁슨, 존 말코비치,,아동보호국에서 근무하는 카일은 아프가니스탄 파병지에서 동료를 잃었던 끔찍한 기억으로 힘든 나날을 보낸다.<br/>직장 동료와 맥시코 출신 미아 매니와 함께 계부이자 하원의원인 샘이 운영하는 넬슨 매장에 잠시 들렀던 카일은 매장 직원들 및 다른 고객들과 함께 자살폭탄 테러범의 인질이 된다.<br/>카일은 다른 인질들을 구하기 위해 테러범과 목숨을 건 싸움 끝에 테러범들을 제압하고 인질들과 함께 폭파 직전에 매장에서 탈출해야만 하는데...
9,비하인드 유,관람객 평점 없음,미국,86분,2021.10.28,15세 관람가,https://movie-phinf.pstatic.net/20211006_242/16334966809722d0b0_JPEG/movie_image.jpg?type=m203_290_2,공포,,,,애디 밀러, 잔 브로버그 펠트, 필립 브로디,"엄마의 갑작스러운 죽음으로<br/>‘베스’ 이모의 집으로 오게 된 ‘올리비아’와 ‘클레어’.<br/>그날 밤, 기묘한 목소리를 듣게 된 ‘클레어’는 언니 몰래<br/>출입금지였던 지하실로 들어가게 되고,<br/>그곳에서 충격적인 실체와 마주하게 되는데…"
10,구원받은 도둑,관람객 평점 없음,미국,93분,2021.10.28,12세 관람가,https://movie-phinf.pstatic.net/20211025_295/1635144523476p5bgo_JPEG/movie_image.jpg?type=m203_290_2,드라마,,,,제이 지앤넌, 스텔리오 사반트,,어린 소년 디스마스는 어머니를 잃고 동생 요담과 함께 사막을 떠돌다 한 도적 무리를 만나 그들과 함께 오랜 시간을 도적질로 일생을 보내다. 어느 날 형제는 로마 군사에게 체포되어 죄값으로 죽음을 마주하고 함께 십자가에 못박힌 예수를 보며 위대한 고백을 하는데…
11,케이지드,관람객 평점 없음,미국,80분,2021.11.11,15세 관람가,https://movie-phinf.pstatic.net/20211103_62/1635915325328vK4D6_PNG/movie_image.jpg?type=m203_290_2,스릴러, 드라마, 공포, 범죄,에디 가테지, 멜로라 하든,,"정신과 의사 할로우는 아내 앰버를 죽였다는 이유로 무기징역을 선고받고, 독방에 일주일 동안 수감된다. 악명높기로 소문난 색스 교도관은 할로우가 유죄라 확신하고 각종 이유로 할로우의 독방 생활 기간을 연장한다.', <br/>옆방 죄수의 자살과 길어지는 독방 생활 중에도 무죄를 확신하며 억울함을 호소하던 할로우는 자신이 몰랐던 아내의 죽음에 대한 어두운 진실이 있음을 알게 되고….', <br/>', <br/>최후의 순간! 그에게 주어진 시간은 단 1분.', <br/>과연 할로우는 그날의 진실을 마주할 수 있을까?"
12,색다른 그녀,관람객 평점 없음,한국,108분,2021.10.14,청소년 관람불가,https://movie-phinf.pstatic.net/20211001_27/1633064014267carNI_JPEG/movie_image.jpg?type=m203_290_2,멜로/로맨스, 코미디,,,혁, 장성윤,,"여자친구 ‘지연’과 결혼을 앞둔 완벽남 ‘완준’', <br/>', <br/>‘완준’은 사고뭉치 선배로부터 받은 부탁으로', <br/>‘지연’에게도 말 못 할 은밀한 비밀을 갖게 된다.', <br/>', <br/>어느 날, ‘완준’은 ', <br/>자신을 짝사랑하는 직장동료 ‘예리’에게', <br/>이 사실을 들키게 되고,', <br/>그녀와 뜻밖의 계약을 맺게 되는데…', <br/>', <br/>갑자기 꼬여버린 인생!', <br/>무사히 결혼에 골인할 수 있을까?!"
13,여대괴담,관람객 평점 없음,중국,88분,2021.09,15세 관람가,https://movie-phinf.pstatic.net/20210831_72/1630372947127FXtNk_JPEG/movie_image.jpg?type=m203_290_2,공포, 스릴러,,,전계문, 강호문,,"어릴 적 장애로 인해 언어치료사의 꿈을 갖고 있었던 이진흔은 대학 시험을 망치는 바람에 집에서 멀리 떨어진 외딴 대학 언어치료학과에 입학을 하게 된다. 기숙사 3층을 홀로 쓰게 된 진흔은 밤마다 계속되는 이상한 소리에 시달리는데... 그러던 어느 날 방에 숨어 들어온 유미라는 학생과 친구가 된다. 학교에서 만난 친구들은 모두가 까칠하게 굴었지만, 유미는 그들과 달리 진흔에게 살갑게 굴고 같이 시간을 보내면서 금세 친해진다. 그러나 학교에서는 계속 이상한 일들이 일어나고, 유미는 그때마다 진흔을 구해주는데..."
14,우리가 죽기를 바라는 사람들,관람객 평점 없음,미국,102분,2021.09,전체 관람가,https://movie-phinf.pstatic.net/20210903_95/1630636189023FPfU2_JPEG/movie_image.jpg?type=m203_290_2,스릴러,,,,시옵한 폴론,,,"올해 대학에 입학한 첫째 아들 지미의 클럽 활동과 기상 시간까지 챙기는 바바라는 네 아이의 엄마다.<br/>어느 날, 대학 클럽 신고식에서 지미가 사망하는 사고가 발생하지만 어느 누구도 책임지려 하지 않는다.<br/>긴 시간을 침묵으로 기다린 바바라는 잠시 집안일을 미뤄 둔 채 지미를 위한 프로젝트를 시작하는데..."
15,극장판 마이 리틀 포니: 새로운 희망,관람객 평점 없음,미국,90분,2021.09.22,전체 관람가,https://movie-phinf.pstatic.net/20210902_69/1630551063783FBxOi_JPEG/movie_image.jpg?type=m203_290_2,애니메이션, 모험,,,제인 크라코스키, 바네사 허진스, 제임스 마스던,"포니, 페가수스, 유니콘이 함께 조화를 이루며 살던 이퀘스트리아.<br/>하지만 평화가 사라져버린 그곳, 신비로운 마법의 힘마저 잃었다.<br/><br/>예전처럼 모두가 친구가 될 수 있다고 믿는 어스 포니 ‘써니’에게<br/>신비한 뿔을 가진 유니콘 ‘이지’가 나타나고, 운명처럼 친구가 된 둘은<br/>잃어버린 이퀘스트리아의 마법과 우정을 되찾기 위해 머나먼 모험을 떠나는데…<br/><br/>과연, 친구들은 사라진 마법의 힘을 되찾을 수 있을까?<br/><br/>거대한 세계를 뒤바꿀 작은 포니들의 새로운 모험이 시작된다!"
17,사제로부터 온 편지,관람객 평점 없음,한국,100분,2021.08.19,전체 관람가,https://movie-phinf.pstatic.net/20210811_91/1628665925767HcBiN_JPEG/movie_image.jpg?type=m203_290_2,다큐멘터리, 드라마,,,김학렬, 김용태, 김옥희,"1845년, 사제직에 오른 첫 조선인이 탄생한다.', <br/>그의 이름 성 김대건 안드레아.', <br/>', <br/>천주교를 향한 온갖 박해와 고난 속에서도', <br/>평등사상과 박애주의를 실천하고자 했던 그는', <br/>', <br/>서양 성직자 입국 해로 탐색 도중 체포되어,', <br/>25년 25일이라는 짧은 생을 마치고', <br/>한국인 사제로서 최초의 순교자가 되었다.', <br/>', <br/>절망의 시대, 희망을 향한 여정을 걸었던 청년 김대건이', <br/>2021년, 고난의 시간을 겪고 있을 청년들에게', <br/>격려와 새로운 희망의 메시지를 전한다."
19,킬러의 보디가드 2: 킬러의 와이프,관람객 평점 없음,미국,100분,2021.08.04,15세 관람가,https://movie-phinf.pstatic.net/20210811_5/1628669399436Gf71V_JPEG/movie_image.jpg?type=m203_290_2,액션, 코미디, 범죄,,라이언 레이놀즈, 사무엘 L. 잭슨, 셀마 헤이엑,"미치광이 킬러 ‘다리우스’의 경호를 맡은 후 ', <br/>매일 밤 그의 악몽을 꾸는 보디가드 ‘마이클’ 앞에 나타난 무대포 직진녀 ‘소니아’', <br/>남편 ‘다리우스’가 납치되었다며 다짜고짜 그를 구하러 가야 한다고 하는데…', <br/>', <br/>한 명도 버거운데 그의 와이프까지 플러스?!', <br/>설상가상으로 유럽 전역을 위기로 몰아넣는 사건들이 연속적으로 터지고', <br/>인터폴의 비밀스러운 의뢰까지 추가되는데..', <br/>', <br/>2배 더 강력한, 2배 더 골때리는, 2배 더 커진', <br/>모두가 기다린 1+1 트리플 환장 액션 블록버스터가 온다!"
22,언노운 아이덴티티,관람객 평점 없음,미국,84분,2021.08,15세 관람가,https://movie-phinf.pstatic.net/20210723_42/1627031882745h9l1X_JPEG/movie_image.jpg?type=m203_290_2,액션, 스릴러,,,섀넌 루치오,,,"기억을 잃고 한 호텔 방에서 일어난 여자. 그리고 그 방에서 발견된 시체.<br/>지금 당장 도망쳐야 한다는 한 통의 전화를 받은 그녀는 영문도 모른 채 도망치기 시작한다.<br/>의문의 조직이 그녀를 뒤쫓기 시작하고, 여자는 일촉즉발의 상황에서<br/>자신의 언니라고 주장하는 '빅토리아'의 도움으로 가까스로 위기를 모면한다., <br/>하지만 조직은 끈질기게 그녀를 쫓아오고,<br/>여자는 조금씩 잃어버린 기억의 조각들을 되찾으면서 혼란에 빠지는데…"
24,데빌스 나잇,관람객 평점 없음,미국,97분,2021.08.05,15세 관람가,https://movie-phinf.pstatic.net/20210727_259/16273502080747uURQ_JPEG/movie_image.jpg?type=m203_290_2,액션, 범죄, 공포,,나폴렌,,,"참전 용사였던 ‘빌리’는 고향으로 돌아와 경찰이 되고<br/>마을에서 벌어지는 잔혹한 연쇄 살인의 수사를 맡게 된다.<br/><br/>그러나 살인범에 대한 단서를 찾을 수 없어<br/>수사는 점점 미궁에 빠진다.<br/><br/>그러던 중, 단서를 얻기 위해 소개받은<br/>디트로이트 박물관의 ‘카히르’ 박사를 만난 ‘빌리’는<br/>그곳에서 전설 속 괴물 이야기를 듣게 되는데…"
25,척살대,관람객 평점 없음,중국,86분,2021.08.03,15세 관람가,https://movie-phinf.pstatic.net/20210727_110/1627365064806pJX0i_JPEG/movie_image.jpg?type=m203_290_2,액션,,,,진일나,,,"마도문의 제자 ‘아청’은 사부의 명으로 당문의 장문에게 서신을 전달하려 길을 떠난다.<br/>허나 당문을 비롯한 강호의 각 무림 장문들이 원인 모를 독에 중독되어 사경을 헤매게 되고<br/>그 원인이 불양수의 음모임을 알게 된 ‘아청’은 창술의 ‘복풍’, 상인 ‘강약신’등 동료들과 함께<br/>강호의 평화를 위한 마지막 전투를 준비한다."
28,블러드 비스트,관람객 평점 없음,미국,80분,2021.08.26,청소년 관람불가,https://movie-phinf.pstatic.net/20210720_202/1626764332857gKHid_JPEG/movie_image.jpg?type=m203_290_2,액션, 공포,,,스티븐 모라나, 아리 밀런, 콜므 포어,"붉은 보름달이 뜨는 특별한 저녁, 새로운 공포 게임 앱 ""Werewolves Awaken""의 화려한 런칭 파티가 성대하게 열리고 있다. 천재적인 젊은 개발자 어거스트는 회사에서 떠밀리다시피 파티에 참석한 상황. 게임을 ""야수의 표식""으로 비난하는 로만 신부의 갑작스런 등장으로 어수선해지고, 더구나 잔인하게 훼손된 시체가 발견되면서 파티는 아수라장이 된다. 마침내 살인자는 무시무시한 이빨과 발톱을 드러내고 생존자들과의 처절한 살인게임이 벌어진다."
29,대환장파티,관람객 평점 없음,한국,76분,2021.07.22,청소년 관람불가,https://movie-phinf.pstatic.net/20210712_55/1626077437044RUiWr_JPEG/movie_image.jpg?type=m203_290_2,드라마, 코미디,,,류혜린, 노진원, 안민영,"<뻘짓> : 밤의 황제이자 세상 무서울 것 없는 망나니, ‘승민’. 그런 그에게 인생 가장 큰 걸림돌은 바로 입대다.<br/>군 면제 사유에 아무 해당 사항이 없어 슬픈 ‘승민’에게 ‘희성’과 ‘정민’이 군 면제의 길을 제시하는데...<br/>더 놀고 싶은 세 남자의 황당무계 ‘뻘짓’ 감행기.<br/><br/><군대 가는 남자> : 군대 대신 병역특례업체를 갈 예정이던 ‘창선’은 갑자기 바뀐 법 때문에 군대에 끌려갈 상황에 처한다.<br/>우선 연기하고 보자는 생각으로 인터넷에서 정보를 찾다가 ‘군대 가기 싫은 사람들의 모임’이라는 카페를 발견하는데...<br/><br/><동상이몽> : 남편이 사고로 죽고, 홀로 시어머니를 모시며 살아가는 ‘말자’.<br/>유산 상속을 목적으로 내연남 ‘하남’과 작당모의해 시어머니를 죽이려 하지만 매번 실패한다.<br/>그러던 어느 날 코로나19가 발생하자, ‘말자’는 마지막 희망(?)을 걸고 시어머니의 죽음을 기획하는데...<br/><br/><새벽 3시 르네상스> : 어느 날씨 좋은 가을밤 일요일 새벽 3시.<br/>오늘도 모자란 술과 감성을 채워주는 편의점에 각양각색 다양한 사람들이 모이기 시작한다.<br/>이곳은 유토피아(Utopia)일까?"
30,아메리칸 트레이터,관람객 평점 없음,미국,108분,2021.08,15세 관람가,https://movie-phinf.pstatic.net/20210714_100/16262493905488HqJi_JPEG/movie_image.jpg?type=m203_290_2,전쟁, 드라마,,,알 파치노, 토마스 크레취만, 미도우 윌리암스,"제2차 세계 대전이 끝난 직후,<br/>미국 정부는 평범한 여성을 반역죄 혐의 8건으로 긴급 체포한다.<br/>그녀의 이름은 밀드레드 길라스 a.k.a '액세스 샐리'., <br/>밀드레드는 독일 나치 선전부 장관 '괴벨스'(토마스 크레취만)의 지휘 아래,, <br/>미군의 사기를 떨어트리는 선전 방송을 진행해 미국 국민들의 증오를 한 몸에 받는다.<br/>그녀의 반역죄 유무를 결정하는 재판에 온 국민의 관심이 쏟아지고,<br/>유명 변호사인 '제임스 라플린'(알 파치노)이 밀드레드의 변호를 맡게 되면서 새로운 국면을 맞이하는데...""]"
31,건담 G의 레콘기스타 2: 벨리 격진,관람객 평점 없음,일본,94분,2021.08.06,12세 관람가,https://movie-phinf.pstatic.net/20210730_26/1627610398305yge1y_JPEG/movie_image.jpg?type=m203_290_2,애니메이션, SF, 액션,,이시이 마크, 시마무라 유우, 후쿠이 유카리,"벨리 일행을 구출하기 위해 출격한 ‘델렌센’이 해적 부대의 메가파우나를 급습한다.', <br/>싸움의 상대가 자신의 스승 ‘델렌센’임을 깨닫지 못한 채 G-셀프 안에서 치열하게 맞서 싸우는 ‘벨리’.', <br/>한편, G-셀프 기체와 함께 ‘라라이야 먼데이’까지도 노리고 있는 캐피털 아미는 마스크 부대를 연이어 출격시킨다.', <br/>그 배후에 있는 위협적인 존재는 과연 무엇이며, ‘벨리’와 ‘아이다’는 캐피털 아미를 막아낼 수 있을 것인가?"
32,드라큘라 2021,관람객 평점 없음,아르헨티나,85분,2021.08.05,전체 관람가,https://movie-phinf.pstatic.net/20210705_262/1625469196242m2MiM_JPEG/movie_image.jpg?type=m203_290_2,공포,,,,제라르도 로마노,,,"세실리아와 마르틴 모자는 교통사고를 당했다. ', <br/>사고 발생 사흘째, ', <br/>그녀는 혼자 아들을 찾아 헤매고 있지만 실마리조차 없다. ', <br/>그러던 중 최근 3일간 발생한 의문의 살인 사건들에 자신 ', <br/>그리고 미지의 존재가 연관된 것을 느끼게 된다. ', <br/>결국 살육의 주범을 찾던 그녀 앞에 상상을 초월한 ', <br/>거대한 태초의 악이 나타난다."
33,위 윌 락 유,관람객 평점 없음,미국,107분,2021.07,전체 관람가,https://movie-phinf.pstatic.net/20210705_272/1625472891271MhCXb_JPEG/movie_image.jpg?type=m203_290_2,뮤지컬,,,,브라이언 바움가트너,,,"크리스천 록이 열풍을 일으키던 1986년 여름<br/>10대 소년 마이클과 친구들은 크리스천 메탈 밴드 3:16을 결성한다.<br/>이들의 뛰어난 실력 덕분에 밴드는 금세 유명세를 얻게 되고, 유명 밴드 매니저 출신의 스킵이 지방 순회공연을 제안한다.<br/>교회와 캠프를 중심으로 공연을 하며 점점 더 큰 인기를 누리게 된 친구들. 하지만, 새로운 멤버 영입 문제로 다툼이 발생하는데..."
38,스페셜 포스 전랑,관람객 평점 없음,중국,72분,2021.07,15세 관람가,https://movie-phinf.pstatic.net/20210628_46/1624868498168Y7GII_JPEG/movie_image.jpg?type=m203_290_2,판타지, 액션,,,진성욱,,,"강납시 공안 특경대들이 임무 수행 중에 습격을 받아 한 명은 사망하고 나머지 셋은 부상당한 채 납치를 당한다. 범인은 검은 조직 풍구파의 우두머리 풍구성으로, 그의 목적은 감옥에 있는 동생 풍구량과 인질들을 교환하는 것이다. 특경대 대장 소극은 이번 임무를 맡게 되었지만 별다른 진전을 보이지 못한다. 그러던 와중 지난번 풍구파 소탕 작전에서 군기를 어기고 특전사를 전역한 주양이 그의 앞에 나타난다. 풍구성으로 인해 중대장을 잃은 주양은 풍구성을 잡고 싶다며 작전에 참가 의지를 밝힌다."
39,다크 스펠,관람객 평점 없음,러시아 연방,92분,2021.09.02,청소년 관람불가,https://movie-phinf.pstatic.net/20210830_18/1630313073309weuuD_JPEG/movie_image.jpg?type=m203_290_2,멜로/로맨스, 공포,,,야나 옌자예바, 콘스탄틴 벨로샤프카, 일리야 예르몰로프,"“우리를 두 양초처럼 얽히게 해 주세요<br/>첫 번째 초는 당신 것, 두 번째 초는 내 것<br/>당신은 내 것, 나는 당신의 것”<br/><br/>사랑하는 남자에게 버림받은 제냐.<br/>그의 마음을 되돌리기 위해 ‘검은 결혼식’이라는 주문을 걸고 사랑을 되찾는다.<br/>하지만 그녀를 향한 그의 사랑은 점점 광적인 집착을 보이는데…"
40,서유기: 재세요왕,관람객 평점 없음,중국,95분,2021.09.30,전체 관람가,https://movie-phinf.pstatic.net/20210927_208/1632721865632KClqK_JPEG/movie_image.jpg?type=m203_290_2,애니메이션,,,,최승훈, 윤세웅, 서정익,"삼장법사에 의해 오행산 기슭에서 구출된<br/>‘손오공’은 과오를 뉘우치고 경전을 배우기 위해 서역으로 길을 떠난다.<br/><br/>긴 여정의 길, 배고픔을 주체하지 못한 ‘손오공’과 친구들은<br/>만년의 한번씩 열린다는 인삼과 열매를 몰래 따먹게 되고<br/><br/>설상가상 신선수라 여기는 인삼과 나무를 파괴해 버리자<br/>나무 아래 봉인되어 있던 요괴의 왕 ‘원체’가 깨어나고만다.<br/>세상은 혼란에 휩싸이고, 요괴들은 날뛰기 시작하는데..<br/><br/>‘손오공’, 전설에 맞서 세상을 구할 수 있을 것인가!"
43,공작조: 현애지상,관람객 평점 없음,중국,120분,2021.09.16,15세 관람가,https://movie-phinf.pstatic.net/20210917_12/1631847362405tvt9o_JPEG/movie_image.jpg?type=m203_290_2,범죄, 드라마, 스릴러,,장한위, 위허웨이, 주아문,"냉전이 감도는 1931년 중국, <br/>소련에서 훈련을 받고 돌아온 4명의 특수요원은<br/>작전명 ‘새벽’이라는 비밀 임무에 착수한다.<br/><br/>순조로울 것만 같았던 그들의 작전은<br/>한 반역자에 의해 위협에 휩싸이게 되고<br/><br/>그 누구도 믿을 수 없는 일말의 상황 속, <br/>이들의 숨통은 점점 조여오기 시작하는데..<br/><br/>1931년, 암호명 ‘새벽’<br/>조국을 위한 이들의 작전이 시작된다!"
46,신 강시선생,관람객 평점 없음,중국,78분,2021.08,15세 관람가,https://movie-phinf.pstatic.net/20210715_85/1626336755323L7t3E_JPEG/movie_image.jpg?type=m203_290_2,공포, 액션, 스릴러,,전소호, 서소강,,배고픈 귀신들을 위한 귀신절에<br/>갑자기 출몰한 강시들로<br/>마을은 위기에 빠지게 된다.<br/><br/>혼비백산이 된 마을을 구하기 위해<br/>사투를 벌이는 퇴사마 ‘하오’는<br/>이 사태에 무시무시한 음모가<br/>숨겨져 있다는 것을 밝혀내는데…<br/><br/>역대급 퇴마 호러액션이 온다!
47,콰이어트 존,관람객 평점 없음,영국,80분,2021.07,전체 관람가,https://movie-phinf.pstatic.net/20210609_281/1623202674081c0p7P_JPEG/movie_image.jpg?type=m203_290_2,스릴러,,,,수지 프란시스 가튼,,,"오랜 시간 해외에서 군 생활을 한 마틴은 크리스마스를 맞아 고향에서 가족과 함께 시간을 보낸다.<br/>그해 겨울, 고향의 연례 전통 축제인 '드로빙' 하루 전날에 여동생 메건이 실종되는 사건이 발생한다., <br/>1년 후, 우연히 메건의 친구 테스를 만난 마틴.<br/>테스에게서 집단 종교 단체 이야기를 듣게 된 마틴은 동생의 실종 사건과 연관되어 있다고 느끼는데..."
48,피어 오브 레인,관람객 평점 없음,미국,109분,2021.07.22,15세 관람가,https://movie-phinf.pstatic.net/20210716_205/1626417712090wldC2_JPEG/movie_image.jpg?type=m203_290_2,드라마, 공포, 스릴러,,매디슨 아이스먼, 이스라엘 브로우사드, 캐서린 헤이글,"정신분열증을 앓고 있는 10대 소녀 ‘레인’<br/>어느 날, 옆집에 살고 있는 학교 선생님의 다락방에 감금되어 있는 어린 소녀를 보고 납치라고 의심하기 시작한다.<br/>누구도 그녀의 말을 믿어주지 않지만 유일하게 전학생 ‘케일럽’만이 그녀를 믿고 도와준다.<br/>‘레인’은 진실을 파헤치기 위해 몰래 옆집으로 들어가게 되는데…!<br/>과연 소녀의 정체는 무엇일까?"
49,졸트,관람객 평점 없음,미국,91분,2021.10.14,15세 관람가,https://movie-phinf.pstatic.net/20210927_93/1632732650895zgP9f_JPEG/movie_image.jpg?type=m203_290_2,액션,,,,케이트 베킨세일, 스탠리 투치, 바비 카나베일,사랑하는 남친을 잃은 그녀.<br/>더 이상의 통제는 필요 없다.<br/>제대로 돌아버린 자.<br/>그녀의 숨은 능력이 깨어난다!<br/><br/>백만 볼트 짜릿한 액션이 시작된다!
50,라스트 히어로즈,관람객 평점 없음,이탈리아,136분,2021.07,청소년 관람불가,https://movie-phinf.pstatic.net/20210611_76/1623391808579pwIFv_PNG/movie_image.jpg?type=m203_290_2,액션, SF,,,로베르토 단토나, 안나마리아 로루소 ,,"사악한 마녀에 대한 전설이 내려오는 노아라 마을.<br/>알란과 친구들은 우연히 들어간 숲속에서 마녀가 봉인된 관을 발견하고 믿을 수 없는 광경을 목격한다.<br/>20년 후, 마을에서 발생한 동물 연쇄 살해 사건을 조사하기 위해 고향으로 돌아온 알란은<br/>오랜만에 친구들을 만나 과거의 사건을 회상하는데..."
