,title,vote,country,time,open_date,grade,poster_path,genre_1,genre_2,genre_3,genre_4,actor_1,actor_2,actor_3,content
477,변태함정에 걸린 슬림핏 청순녀,관람객 평점 없음,일본,60분,2020.03.19,청소년 관람불가,https://movie-phinf.pstatic.net/20200320_182/1584685483309PgIBC_JPEG/movie_image.jpg?type=m203_290_2,드라마, 에로,,,아리사카 미유키, 시모키타 타쿠안, 야부카와 히토시,"‘아리사카 미유키’는 자신을 기분 나쁘게 쳐다보는 한 이웃 남자 때문에 신경이 쓰인다. 하지만 그 사실을 이야기해도 별 반응이 없는 남편. 그러던 어느 날, 미유키에게 말을 걸은 이웃 남자. 그는 미유키가 바람을 피운다는 사실을 알고 있으며, 이를 남편에게 폭로하겠다고 협박하며 잠자리를 강요한다. 미유키는 계속되는 괴롭힘을 견디다 못해 그를 경찰에 신고한다. 그리고 겨우 평온한 나날을 되찾은 그녀. 하지만 늦은 밤 그녀의 집 안에 경찰서에 잡혀있어야 할 그가 모습을 드러내는데…"
479,엑소시즘 : 잠들지 못하는 시간,관람객 평점 없음,오스트레일리아,87분,2020.05.04,청소년 관람불가,https://movie-phinf.pstatic.net/20200326_134/1585186923341fsXCG_JPEG/movie_image.jpg?type=m203_290_2,공포, 스릴러,,,사라 웨스트, 벤슨 잭 안소니, 에릭 톰슨,"의대생 칼라는 희귀 유전병 ‘치명적 가족성 불면증’을 앓고 있는 남동생 블레이크가 걱정이다. 죽을 때까지 잠을 못 자는 무시무시한 병으로, 장기 손상을 거쳐 결국 죽음에 이르기 때문이다. 칼라는 돌아가신 부모님의 친우 로버트 박사의 권유로 블레이크를 데리고 지하의 한 비밀 치료실에 들어간다. 그러던 어느 밤, 칼라는 누군가 숨겨 놓은 일기장과 비디오테이프를 발견하고, 블레이크는 악령에 씐 듯 이상 증세를 보이기 시작하고 결국 각성한 악령과의 처절한 대결이 펼쳐진다."
480,킹덤: 아메리칸 좀비,관람객 평점 없음,미국,81분,2020.04.09,15세 관람가,https://movie-phinf.pstatic.net/20200326_220/1585205877417XVqIC_JPEG/movie_image.jpg?type=m203_290_2,코미디, 드라마,,,랜던 바우저,,,"[""좀비가 창궐한 지 수십 년 째, 좀비 '엉클 존'은 자신만의 독보적인 매력으로 엄청난 인기를 끌고 방송국에서는 서로 그를 취재하려 앞다툰다., <br/>한편, 엉클 존의 인기를 이용해 돈을 벌기 위한 정체불명의 사람들을 그를 납치할 계획을 세우는데..."
482,촉산2 항마전,관람객 평점 없음,중국,71분,2020.04.02,12세 관람가,https://movie-phinf.pstatic.net/20200323_183/1584948017399m32y0_JPEG/movie_image.jpg?type=m203_290_2,액션, 판타지, 무협,,성영호, 조섬섬, 팽옹사,마도에 빠진 마녀는 사대 흉수의 힘이 깃든<br/>네 개의 영주를 모아 삼계를 멸망시키려 한다..<br/>마녀는 촉산의 곤륜파와 아미파를 학살하지만<br/>살아남은 수제자들은 마지막 영주를 찾으러<br/>마룡산으로 떠나고 신들의 전쟁이 시작되는데…<br/><br/>신계와 마계의 마지막 전쟁을 만난다!
483,푸드 몬스터,관람객 평점 없음,중국,77분,2021.05.19,전체 관람가,https://movie-phinf.pstatic.net/20210429_138/1619673133974Lq4z0_JPEG/movie_image.jpg?type=m203_290_2,애니메이션, 드라마, 가족, SF,손선영, 원에스더, 이승행,"뱃속의 동전 때문에 자꾸만 몸이 멈추는 만두 ‘페니’.', <br/>어느 날 ‘콘래드 퓨전’이 나타나', <br/>완벽한 음식으로 만들어준다며 ‘페니’와 친구들을 데려간다.', <br/>', <br/>하지만 그의 진짜 목표는', <br/>음식들을 개조해 ‘푸디버스’를 손에 넣는 것!', <br/>', <br/>이 사실을 알게 된 ‘페니’는 친구들과 함께', <br/>‘푸디버스’를 구하기 위한 위험천만한 모험에 뛰어드는데…', <br/>', <br/>이제껏 본 적 없는 ‘맛있는’ 우주전쟁이 펼쳐진다!"
484,꼴통 2인조,관람객 평점 없음,한국,81분,2020.04.09,15세 관람가,https://movie-phinf.pstatic.net/20200319_31/1584594654372M5vev_JPEG/movie_image.jpg?type=m203_290_2,액션,,,,차지혁, 황윤성,,"“스파링 1분에 만원!”', <br/>매일 같은 일상에 지친 ‘정만’은 돈 벌 궁리를 하던 중', <br/>돈과 맷집을 맞바꾸는 ‘인간 샌드백’ 알바 아이디어를 낸다.', <br/>그날부터 까칠한 놈 ‘휘’, 최강 맷집 ‘민규’는 팀이 되어', <br/>글러브 하나만을 손에 낀 채 길 위로 나선다.', <br/>하지만 일탈도 잠시, 돈도 본능도 쉽게 만족되지 않고', <br/>피 끓는 파이터들의 갈증은 더욱 깊어져만 가는데…', <br/>', <br/>어느 날 이들의 앞에 나타난 미스터리한 동창 '유영'은"", <br/>무려 세 배로 수익을 올려 주겠다는 파격적인 제안을 하고', <br/>이들은 비밀리에 운영중인 도박판에 발을 들이게 된다.', <br/>', <br/>길거리 대신 짜릿한 격투 도박판에 뛰어든 갱생불가 꼴통들,', <br/>배팅이 시작되는 순간, 더 이상 빠꾸는 없다!"
486,보존상: 천년의 유혼,관람객 평점 없음,중국,125분,2020.04.29,15세 관람가,https://movie-phinf.pstatic.net/20200423_193/1587606045368oIYDS_JPEG/movie_image.jpg?type=m203_290_2,무협,,,,이가, 류잔,,"마계의 성군이 육계의 힘을 훔쳐 패자의 지위를 빼앗으려 하자<br/>천계의 천제는 육계의 힘인 '능력석'을 두 여자 아기에게 봉인해, <br/>인간계에 숨겨서 마군의 음모를 막고자 한다.<br/><br/>수년 뒤 마군은 당나라 여인 '당멱멱'을 꾀어 , <br/>천 년을 찾아 헤맨 '보존상'이 인간계에 있다고 알려주며 영혼까지 찾아준다., <br/>하지만 이는 두 공주를 찾고 '능력석'을 손에 넣으려는 마군의 계략으로 , <br/>'보존상'은 그만 위기에 처하고 마는데..., <br/><br/>인간사에 개입한 죄로 기억이 봉인된 채 인간으로 좌천된 '보존상'은 , <br/>과연 신력을 깨워 능력석과 두 공주를 지킬 수 있을까?"
487,더 복서: 격투의 신,관람객 평점 없음,중국,104분,2020.04.16,15세 관람가,https://movie-phinf.pstatic.net/20200416_158/1586998320252Np14P_JPEG/movie_image.jpg?type=m203_290_2,드라마, 액션,,,양곤, 하재동,,"챔피언리그 중 불의의 사고로', <br/>절친했던 후배 선수를 죽음에 이르게 한 프로복서 ‘카이’', <br/>그는 오명을 쓰고 불명예 은퇴를 하게 된다.', <br/>모든 것을 잃고 폐인처럼 살고 있던 어느 날', <br/>‘카이’에게 그간의 잘못을 바로잡을 단 한번의 기회가 찾아오고', <br/>그는 마지막으로 링 위에 오르기로 결심하는데…', <br/>', <br/>모든 것을 잃은 한 남자의 마지막 경기가 시작된다!"
488,데드워터,관람객 평점 없음,미국,89분,2020.05.28,15세 관람가,https://movie-phinf.pstatic.net/20200513_1/15893604728744d2hB_JPEG/movie_image.jpg?type=m203_290_2,스릴러,,,,캐스퍼 반 디엔, 그리프 퍼스트, 브리안느 데이비스,"외상 후 스트레스 장애를 겪고 있는 퇴역 군인 ‘쿠퍼’는', <br/>친구 ‘존’의 초대로 아내 ‘비비안’과 함께 호화 요트 여행을 떠난다.', <br/>바다 한가운데서 여유로운 시간을 보내던 쿠퍼는', <br/>존과 비비안 사이에서 이상 기류를 포착한다.', <br/>의심이 점점 커져가던 중, 요트의 시동이 꺼지고', <br/>쿠퍼는 고립된 망망대해 속에서 아내를 지켜내야만 하는데…!', <br/>', <br/>태평양 한가운데서 멈춰 버린 요트', <br/>아내를 지키기 위해 목숨을 건 대결이 시작된다!"
489,이웃의 아내,관람객 평점 없음,영국,97분,2020.05.26,15세 관람가,https://movie-phinf.pstatic.net/20200512_106/1589261995359EsRRQ_JPEG/movie_image.jpg?type=m203_290_2,멜로/로맨스, 스릴러,,,윌리암 피츠너, 제시카 맥나미,,"결혼생활을 성실하게 지켜 온 중년 남성 ‘마이크’는', <br/>이웃집으로 이사 온 젊은 아내 ‘제나’에게 끌림을 느낀다.', <br/>정원 관리를 도와주며 제나와 가까워지던 중,', <br/>마이크는 제나가 가정폭력을 당하고 있다는 사실을 알게 된다.', <br/>남의 일에 관여하지 말라는 아내의 만류에도 불구하고', <br/>제나를 보호하려던 마이크는 예상치 못한 파국을 맞이하게 되는데...', <br/>', <br/>옆집에 이사 온 매력적인 젊은 아내', <br/>금단의 열매를 향한 위험한 욕망이 시작된다!"
492,벨빌 캅,관람객 평점 없음,프랑스,111분,2020.06.25,15세 관람가,https://movie-phinf.pstatic.net/20200618_80/1592461627412kkfcB_JPEG/movie_image.jpg?type=m203_290_2,범죄, 액션,,,오마 사이,,,"프랑스 벨빌의 평범한 경찰 케이타. 그에게 오랜만에 친구가 찾아오지만, 반가움도 잠시 정체를 알 수 없는 괴한들에게 총을 맞고 그 자리에서 죽고만다. 친구의 죽음이 국제적인 마약 범죄단과 연관이 있음을 알게된 케이타는 놈들을 소탕하기 위해 마이애미로 떠난다. 마이애미의 가르시아 형사의 도움을 받아 추적해가는 케이타. 그러나 너무나도 맞지 않는 둘의 수사는 계속해서 삐그덕거릴 뿐이다.', <br/>', <br/>그래도 포기란 없다.', <br/>일단 직진! 노빠꾸 수사 액션이 펼쳐진다!"
493,슈퍼펫,관람객 평점 없음,영국,88분,2020.08.13,전체 관람가,https://movie-phinf.pstatic.net/20200722_290/1595383570763Reaf8_JPEG/movie_image.jpg?type=m203_290_2,애니메이션,,,,루크 에반스, 닉 프로스트, 젬마 아터튼,"잃어버린 우주 캡슐을 찾으면 주인님을 만날 수 있어!<br/>1969년, 우주 캡슐을 타고 머나먼 우주로 모험을 떠난 용감한 강아지 ‘버디’는<br/>예상치 못한 사고로 50년이 흐른 지구, 글렌필드에 불시착한다.<br/>하지만 예전과 달리 동물과 인간의 사이가 적대적으로 변해버린 그곳에서<br/>‘버디’는 주인을 찾기 위해 고군분투하고, 그러던 중 최첨단 스마트 영웅 터보캣을 만나는데…!<br/>인간들이 동물을 다시 사랑하는 그날까지!<br/>스타독 ‘버디’와 터보캣 ‘펠릭스’는 동물들도 지키고 주인도 찾을 수 있을까?"
494,토네이도: 지구 재앙의 날,관람객 평점 없음,미국,88분,2020.04.24,15세 관람가,https://movie-phinf.pstatic.net/20200420_1/1587365741333AD2G1_JPEG/movie_image.jpg?type=m203_290_2,액션,,,,데이빗 G.B. 브라운,,,인기 소설 작가 잭은 25년 전 사라진 아버지의 진실을 밝히기 위해 숲속 산장으로 향했다가 사상 초유의 토네이도를 만나게 된다. 토네이도에서 살아남기 위한 유일한 단서는 아버지가 남긴 녹음기의 메세지! 이제 잭은 목숨을 위협하는 재난 사태에 맞서 살아남아야만 한다.
495,샬롯: 욕망의 법칙,관람객 평점 없음,미국,74분,2020.05.01,청소년 관람불가,https://movie-phinf.pstatic.net/20200422_82/1587545928299UHLbO_JPEG/movie_image.jpg?type=m203_290_2,멜로/로맨스, 드라마,,,다샤 네크라소바, 모건 크란츠,,시인을 꿈꾸며 베를린까지 날아온 샬롯. 낯선 도시에서 만난 매력적인 남자 프란츠에게 이미 애인이 있다는 것을 알면서도 유혹에 빠지고 만다. 뜨거운 사랑의 날들을 보내던 중 심지어 전 남자친구 올리버까지 샬롯 앞에 나타난다. 이제 더욱 도발적이고 위험한 욕망의 밤이 시작된다.
497,금기를 깨트린 여자들,관람객 평점 없음,스페인,104분,2020.05.20,청소년 관람불가,https://movie-phinf.pstatic.net/20200428_51/1588062167441cWCzr_JPEG/movie_image.jpg?type=m203_290_2,공포,,,,콜린 샤빈, 알지라 고메즈,,심각한 부상을 입고 헤메던 남자는 여자들만 모여 사는 비밀스러운 저택에 머물게 된다. 낯선 남자의 등장에도 당황하기 보다는 호기심을 보이는 그녀들. 각기 다른 매력을 지닌 여자들은 숨겨온 욕망을 차츰 드러낸다. 이제 한 남자를 둘러싼 여자들의 치명적인 매혹의 밤이 시작된다.
498,킬 모드,관람객 평점 없음,네덜란드,97분,2020.06.25,15세 관람가,https://movie-phinf.pstatic.net/20200512_52/1589251300151U04Rq_JPEG/movie_image.jpg?type=m203_290_2,액션,,,,데이브 멘텔, 줄리아 베이틀란, 야스민 블레이크,치명적인 바이러스가 전세계에 퍼지고<br/>컴퍼니는 치료제를 내놓아 모든 것을 통제한다.<br/>저항군은 컴퍼니가 바이러스를 퍼트렸다고 의심하고<br/>컴퍼니는 특수부대를 투입하여 저항군을 몰살하려 한다.<br/>드디어 음모를 밝히려는 저항군과 컴퍼니의<br/>운명을 건 논스톱 전투가 시작되는데…
499,컬트 걸,관람객 평점 없음,오스트레일리아,83분,2020.06.02,청소년 관람불가,https://movie-phinf.pstatic.net/20200601_210/1590997533976V6pOC_JPEG/movie_image.jpg?type=m203_290_2,공포,,,,사라 램버그, 제인 배들러, 앨버트 고익맨,"[""이교도 집단인 '골든패스'에서 자란 달리아와 두 여동생. 경찰의 수사망으로 달리아 혼자 구조되고 동생들과 헤어지게 된다. 몇 년이 지나고, 다시 사이비 종교의 징후가 나타나자 달리아는 두 여동생의 행방을 찾기 위해, 골든패스와 연관이 있는 '머록'을 찾아 비밀의 숲으로 떠나는데...""]"
503,레지스탕스,관람객 평점 없음,프랑스,121분,2021.09.09,15세 관람가,https://movie-phinf.pstatic.net/20210901_206/1630476127597lC9ua_JPEG/movie_image.jpg?type=m203_290_2,드라마,,,,제시 아이젠버그, 클레멘스 포시, 마치아스 슈와바이어퍼,"나치 점령 국가에서 자란 젊은 청년 마르셀은 찰리 채플린과 같이 전설의 마임 배우를 꿈꾸며 연극, 그림 그리기 등 다양한 예술 활동에 매진한다. 그러나 세계 2차 대전이 발발하고 프랑스가 연합국으로 참전하자, 마르셀 역시 프랑스 저항군 “레지스탕스”에 포섭이 된다. 그리고 그곳에서 마르셀은 잠시 꿈을 뒤로하며, 평소 뛰어난 언변과 연기력 등을 이용해 홀로코스트로 고통받는 수 천명의 아이들을 구출해내는 비밀 작전을 수행하게 된다."
507,디지몬 어드벤처 라스트 에볼루션 : 인연,관람객 평점 없음,일본,114분,2021.02.17,12세 관람가,https://movie-phinf.pstatic.net/20200515_88/1589512642615JWBeQ_JPEG/movie_image.jpg?type=m203_290_2,애니메이션, 모험,,,하나에 나츠키, 호소야 요시마사, 사카모토 치카,"컴퓨터 모니터를 통해 세상 밖으로 나온 의문의 알.<br/>타이치와 히카리 남매 앞에 디지몬과의 신비롭고 운명적인 만남이 펼쳐진다.<br/><디지몬 어드벤처 : 운명적 만남><br/><br/>""우리들의 끈끈한 \'인연\'을 보여주자.""<br/>대학생 타이치와 다른 '선택받은 아이들'은 모두 각자의 자리에서 저마다의 삶을 살아가고 있다., <br/>그러던 어느 날, 전 세계의 '선택받은 아이들'에게 의문의 사건이 일어나기 시작한다., <br/>에오스몬이라 불리는 디지몬에 그 원인이 있음을 알게 된 타이치 일동은 에오스몬을 제압하려 하지만 이내 아구몬을 비롯한 디지몬들의 진화에 문제가 발생하는데…<br/>세상의 이변에서 다시 한번 친구들을 구할 수 있을까?<br/><디지몬 어드벤처 : 라스트 에볼루션 인연>"
510,소시오패스,관람객 평점 없음,미국,69분,2020.02.20,15세 관람가,https://movie-phinf.pstatic.net/20200214_212/1581664436226LCfTu_JPEG/movie_image.jpg?type=m203_290_2,스릴러, 범죄,,,에린 맥개리, 마이클 드레이퍼, 데니스 핏츠패트릭,"사람들이 없는 한적한 곳으로 캠핑을 떠난 연인 크리스토퍼와 로리.<br/>깊은 산속에서 둘 만의 오붓한 밤을 즐기던 중 갑자기 총성이 울린다.<br/><br/>다음날 아침 가까스로 정신을 차린 로리. <br/>애인은 감쪽같이 사라졌고, 팔에는 깊은 상처만이 남았다. <br/><br/>이제 지옥으로 변해버린 이 숲에서 필사적으로 탈출해야 한다!"
511,익스트랙션,관람객 평점 없음,미국,116분,2020.04.24,청소년 관람불가,https://movie-phinf.pstatic.net/20200402_260/1585818978643t1zLK_JPEG/movie_image.jpg?type=m203_290_2,액션, 드라마,,,크리스 헴스워스, 루드락 자스왈,,세계에서 가장 위험한 도시로 납치된 의뢰인의 아들을 구하기 위해<br/>전직 특수부대 출신 용병이 거대 범죄 조직에 맞서 벌이는 리얼 액션 구출극
512,도둑냥,관람객 평점 없음,한국,105분,2020.04.15,청소년 관람불가,https://movie-phinf.pstatic.net/20200401_67/1585709407575x0lYM_JPEG/movie_image.jpg?type=m203_290_2,코미디,,,,한지호, 이예지,,"2028년 2월, 사진관을 운영하며 무료한 시간을 보내는 노총각 석구에게 묘령의 여인이 조폭같은 사내에게 쫓기듯 들어와 제발 살려달라고 합니다. 자신은 거대 조폭의 딸이며, 반란을 일으킨 부하들이 아빠를 죽이고선 엄청난 재산을 노리는데 자신을 도와주면 백억을 주겠다고 하면서 석구에게 매일 푼돈을 뜯어갑니다. 아무리 봐도 은숙의 정체가 수상한데, 상상할 수도 없는 일이 석구에게 벌어집니다."
513,레닌그라드 대공습,관람객 평점 없음,러시아 연방,97분,2020.03.17,12세 관람가,https://movie-phinf.pstatic.net/20200221_163/15822481236613tT3i_JPEG/movie_image.jpg?type=m203_290_2,드라마, 액션,,,아르템 비스트로프, 나데즈다 마르키나, 블라디미르 멘쇼프,"제 2차 세계대전이 한창인 1942년 레닌그라드. 지옥 같은 전쟁에서 돌아온 장교 세레차는 우연히 어린 아이들을 만나 도와주게 된다. 하지만 평온한 시간도 잠시, 세레차는 다시 전쟁으로 돌아가게 된다. 곧이어 시작된 대공습. 아이들을 위해서라도 반드시 승리해야만 한다."
514,악몽,관람객 평점 없음,한국,100분,2020.03.12,청소년 관람불가,https://movie-phinf.pstatic.net/20200311_248/15839042685403iV3w_JPEG/movie_image.jpg?type=m203_290_2,미스터리, 스릴러, 공포,,오지호, 차지헌, 지성원,"교통사고로 잃은 딸을 잊지 못하고', <br/>하루하루를 고통으로 보내는 영화 감독 ‘연우’는', <br/>자신의 영화 ‘악몽’을 통해 딸을 살리려 한다.', <br/>', <br/>깊은 슬픔 속에서도 계속 영화를 만들어야만 하는 ‘연우’를', <br/>둘러싸고 미스터리한 사건들이 계속되고,', <br/>꿈과 현실 사이에 혼란스러운 ‘연우’는', <br/>멈출 수 없는 광기 속으로 빠져든다."
515,베를린 호스티지,관람객 평점 없음,독일,97분,2020.03.12,12세 관람가,https://movie-phinf.pstatic.net/20200309_299/158371696133108HQP_JPEG/movie_image.jpg?type=m203_290_2,드라마, 스릴러,,,마티아스 지에싱, 페가 페리도니, 모리츠 하이델바흐,"베를린에서 유일하게 철거되지 않은 아파트, 그곳에서 40년간 살아온 마지막 세입자 ‘하이네’는 끝까지 이주를 거부하고<br/>끔찍한 음모를 꾸미는 재개발 추진 회사 ‘럭스’는 철거 당일, 직원 ‘마크’를 그의 집으로 보낸다.<br/><br/>때마침 아버지 ‘하이네’의 집에 찾아온 아들 ‘토비아스’는 실랑이를 벌이고 있는 둘을 발견하는데<br/>순식간에 세 사람 사이에 손쓸 수 없는 사건이 벌어지고 만다.<br/><br/>충격에 휩싸인 ‘토비아스’의 비명으로 가득 찬 아파트에<br/>설상가상 경찰 ‘시린’까지 찾아오면서 ‘토비아스’는 돌이킬 수 없는 선택을 하게 되는데…"
516,퍼펙트 내니,관람객 평점 없음,프랑스,99분,2020.04.23,15세 관람가,https://movie-phinf.pstatic.net/20200409_243/1586406027107fFO2f_JPEG/movie_image.jpg?type=m203_290_2,드라마, 스릴러,,,카린 비아르, 레일라 벡티, 앙투안 라이나르츠,"육아와 가사로 지칠 대로 지친 두 아이의 엄마 ‘미리암’은', <br/>복직을 결심하고 ‘루이즈’를 보모로 고용한다.', <br/>아이들을 너무나 사랑하고 시키지 않은 집안일까지 해내는', <br/>완벽한 ‘루이즈’ 덕분에 가족들은 꿈꾸던 행복을 맛보고,', <br/>‘루이즈’는 점점 이 집에 없어서는 안 될 존재가 되어간다.', <br/>그 사이, 집 한가운데 비극의 씨앗이 조용히 싹을 틔운다."
517,보르도 우정여행,관람객 평점 없음,프랑스,135분,2020.06.18,12세 관람가,https://movie-phinf.pstatic.net/20200609_56/1591678445936D1sPk_JPEG/movie_image.jpg?type=m203_290_2,코미디, 드라마, 가족,,프랑수아 클루제, 마리옹 꼬띠아르, 로랑 라피트,"생애 최고의 순간! 반짝반짝 빛나는 캐스팅! 보르도 와인처럼 진한 그들의 우정! ', <br/>맥스와 친구들은 매년 여름 맥스의 보르도 별장에서 휴가를 보내왔지만 지난 몇년간 소원해진 친구들은 모이지 않았다. 맥스가 별장을 팔 결심을 했다는 사실을 모르는 친구들은 맥스의 생일을 맞아 몇 년 만에 깜짝 우정여행을 계획하고 보르도에서 모이는데.."
518,루프,관람객 평점 없음,브라질,98분,2021.01,15세 관람가,https://movie-phinf.pstatic.net/20201222_113/16085973044425cPeq_JPEG/movie_image.jpg?type=m203_290_2,액션, 스릴러,,,브루노 가글리아소, 베아트리스 아란테스,,"세상 둘도 없는 사랑하는 연인을 눈 앞에서 잃은 물리학자 다니엘은 바로 그 날, 잔혹한 사건이 있기 직전으로 시간을 되돌릴 수 있는 방법을 알아내고 목숨을 건 위험한 시간 여행을 떠나게 된다. 과거로 돌아가면 쉽게 잡을 수 있을 줄 알았던 범인의 실체는 그러나 점점 묘연해져만 가는데 ..."
520,라비드,관람객 평점 없음,캐나다,107분,2020.06.11,청소년 관람불가,https://movie-phinf.pstatic.net/20200515_72/1589522483604EytKx_JPEG/movie_image.jpg?type=m203_290_2,공포, 액션,,,로라 밴더부트,,,"로즈는 과거의 트라우마를 지닌 채 살아가는 소심한 디자이너 지망생이다. 어느 날, 동료로부터 초대받은 ', <br/>클럽 파티에서 모욕을 당하고 귀가하던 중 교통사고를 당해 안면에 끔찍한 장애를 얻게 된다. 이때 그녀를', <br/>돕겠다는 의문의 인물 버러스 박사의 실험적 치료를 받게 된다. 성공적으로 보이는 약물 치료에 기뻐하지만', <br/>피를 갈망하는 기묘한 부작용이 나타나기 시작한다. 그 후 그녀에게 물리적 상처를 입은 사람들이 잔인한 ', <br/>흡혈 괴물로 변해 인류를 위협하는 끔찍한 감염이 시작되는데..."
524,블러드샷,관람객 평점 없음,미국,109분,2020.05.21,15세 관람가,https://movie-phinf.pstatic.net/20200518_15/1589763097565dNabl_JPEG/movie_image.jpg?type=m203_290_2,액션, 드라마, 판타지, SF,빈 디젤, 에이사 곤살레스, 샘 휴건,"아내와 함께 휴가를 보내던 특수 부대원 ‘레이’(빈 디젤)는 정체불명의 적에게 납치되어 살해당한다.', <br/>혈액 속에 수많은 나노봇을 주입하는 최첨단 프로젝트 블러드샷을 통해 부활한 레이.', <br/>놀라운 치유력과 가공할 만한 파워의 슈퍼 히어로로 업그레이드된 레이는', <br/>아내를 죽인 놈을 찾아 무차별적인 복수의 질주를 시작한다.', <br/>하지만, 자신이 진짜라고 생각했던 것들이 거짓임을 깨닫게 되는데…"
526,샬러턴,관람객 평점 없음,체코,118분,2021.04.22,15세 관람가,https://movie-phinf.pstatic.net/20210408_243/1617857902154TJ2uD_JPEG/movie_image.jpg?type=m203_290_2,드라마,,,,이반 트로얀, 요아힘 파울 아스뷰크,,"20세기 초 체코슬로바키아, 약초로 사람을 치유하는 기적 같은 의술을 가진 얀 미콜라섹.<br/>공인 약초 전문가로 불리는 그는 타고난 재능과 뛰어난 실력으로 곧 유명해지고,<br/>하루에도 수백 명의 환자들을 치료하며 부와 명성을 얻게 된다.<br/><br/>얼마 후, 정권이 교체되고 온갖 훼방으로 모든 걸 잃을 위기에 놓인 그는<br/>수많은 난관을 겪게 되는데…<br/><br/>수백만 명을 살린 기적의 치료법, 그 이면의 숨은 이야기들이 공개된다!"
527,피노키오,관람객 평점 없음,이탈리아,125분,2021.03.18,12세 관람가,https://movie-phinf.pstatic.net/20210308_299/1615180899564QJkvf_JPEG/movie_image.jpg?type=m203_290_2,드라마, 판타지,,,페데리코 예라피, 로베르토 베니니, 마린 백트,"가난하게 살아가던 목공 제페토 할아버지는 멋진 꼭두각시를 만들어 돈을 벌 계획을 세운다. 나무를 구해 꼭두각시를 만들던 할아버지는 깜짝 놀란다. 나무 인형에게서 심장이 뛰는 소리가 들리고, 움직이기 시작한 것이다. 제페토 할아버지는 ‘피노키오’라는 이름을 지어주고, 아들로 삼기로 한다.<br/><br/>하지만 호기심이 많은 피노키오는 말썽만 부리며 할아버지를 걱정만 하게 만들고, 심지어 학교 책을 팔아 인형극 구경을 가게 되는데…!"
