,title,vote,country,time,open_date,grade,poster_path,genre_1,genre_2,genre_3,genre_4,actor_1,actor_2,actor_3,content
196,스마일 페이스 킬러,관람객 평점 없음,미국,96분,2021.01,청소년 관람불가,https://movie-phinf.pstatic.net/20210106_93/1609897488484u7as9_JPEG/movie_image.jpg?type=m203_290_2,공포, 스릴러,,,로넨 루빈스타인, 미아 세라피노,,"1990년대 후반 미국 중서부 지역에서 젊고 잘생긴 남자 대학생만을 살해하는 연쇄살인범이 나타난다.<br/>연쇄살인범은 살해 현장에 웃는 얼굴을 묘사한 독특한 '스마일' 시그니처를 남겨 자신을 쫓는 경찰을 비웃는다., <br/>연쇄살인범을 향한 공포와 호기심으로 도시가 어둡에 휩싸일 무렵,<br/>평범한 대학생 제이크는 발신자 제한 번호로 소름 끼치는 사진과 함께 의문의 문자를 받는데..."
198,범죄도시: 나쁜놈들 전성시대,관람객 평점 없음,미국,100분,2021.01,청소년 관람불가,https://movie-phinf.pstatic.net/20210108_8/1610081326870zdiRx_JPEG/movie_image.jpg?type=m203_290_2,액션,,,,베리 코빈, 클린트 제임스,,"황량한 애리조나 황무지 중심에 어느 날, 최고의 실력을 지닌 총잡이들이 모여든다.<br/>형제의 복수를 위해 냉혹한 살인마가 된 로이스.<br/>살인마에게 걸린 현상금을 노리는 연방 보안관 퀸시.<br/>운명은 두 사람을 외부에 알려지지 않은 미지의 마을로 인도하고, 그곳에서 최후의 결전이 벌어지는데...."
199,"이별유예, 일주일",관람객 평점 없음,한국,147분,2020.12.09,15세 관람가,https://movie-phinf.pstatic.net/20201204_40/1607073099301P733x_JPEG/movie_image.jpg?type=m203_290_2,드라마, 멜로/로맨스,,,유리, 현우, 윤지온,"결혼을앞두고 있던 가람(권유리)과 선재(현우)에게 갑작스레 찾아온 교통사고. ', <br/>그사고로 선재는 혼수상태에 빠지고, 가람은 목숨을잃고 만다. ', <br/>이승을떠난 가람은 알 수 없는 공간에 가게 되고, 그곳에서 정체를 알 수 없는 남자 엑스(윤지온)에게 이해하기 힘든 제안을 받게 된다. ', <br/>', <br/>일주일전으로 시간을 돌려줄 테니, ', <br/>선재를살리고 싶다면 일주일 안에 그와 완전히 헤어지라는 것. ', <br/>', <br/>그렇게일주일 전으로 돌아가게 되는 가람. ', <br/>가람은평생을 함께 하기로 약속했던 선재에게 이별을 말해야만 한다. ', <br/>그러나그제서야 무신경한 행동과 말투 속에 숨어 있던 선재의 진심과 배려들이 가람의 눈에 들어오기 시작한다. ', <br/>선재가사랑을 지키기 위해 홀로 싸워 왔던 애틋한 흔적들을 너무 늦게 마주하고 만다. ', <br/>이별의핑계를 찾아내야만 하는데, 시간이 갈수록 차마 이별할 수 없는 이유들만 가득해진다. ', <br/>', <br/>가람은선재와의 이별에 성공하고 그를 살려낼 수 있을까?"
204,탈혼이진도: 자객의 기억,관람객 평점 없음,중국,88분,2020.11.26,15세 관람가,https://movie-phinf.pstatic.net/20201120_62/1605860480395M5vMY_JPEG/movie_image.jpg?type=m203_290_2,액션,,,,진건봉, 쉬둥둥, 양준우,"5대10국시기. 민국의 민왕이 살아있는 소녀들을 제물로 바치며 하늘에 제를 올리던 밤. 민왕의 조카인 과화와 남당 왕자 이명십, 향룡담 자객 청작은 민국의 보물인 ‘지옥의 불’ 위치가 그려진 지도를 빼앗기 위해 내통하여 민왕을 살해하고 백성들을 모조리 죽인다. 하룻밤 사이에 민국은 멸망하고 민왕의 심복이었던 방존의는 그 전쟁에서 기억을 잃어버린다. 민왕의 심복인 방존의가 지도에 대해 알고 있다고 생각한 이들은 그의 기억을 되살리기 위해 각자의 신분을 속이고 방존의에게 접근한다. 방존의의 기억이 조금씩 돌아오던 어느 날, 그를 보살펴주던 차 점포 행수 전말계가 납치되는 사건이 발생하고, 방존의는 그것이 그를 유인하기 위한 함정이라는 생각은 꿈에도 하지 못한 채 그녀를 찾기 위해 유명곡으로 향하는데……."
205,솔리타리,관람객 평점 없음,영국,89분,2020.12,15세 관람가,https://movie-phinf.pstatic.net/20201127_134/1606465684011lc9G2_JPEG/movie_image.jpg?type=m203_290_2,SF, 액션,,,조니 색혼, 롯티 톨허스트,,"우주의 캡슐에서 깨어난 아이작과 알라나<br/>범죄인 우주 식민지 이주 프로젝트에 의해<br/>개척지로 이동 중에 모선의 폭발로 난파되었다.<br/>줄어드는 산소, 탈출구도 구조대도 없다.<br/>반드시 생존하고 귀환하라!"
207,미트 페어런츠-비기닝,관람객 평점 없음,미국,91분,2021.10.21,15세 관람가,https://movie-phinf.pstatic.net/20211012_191/163402371322338H76_JPEG/movie_image.jpg?type=m203_290_2,코미디, 드라마,,,파시투아 아모사, 에밀리 바클레이, 레이첼 하우스,"[""수목 관리 전문가인 조이는 산부인과에서 임신이라는 진단을 받자 조충 때문에 임신 양성 반응이 나오기도 한다며 의사에게 엉뚱한 소리를 늘어놓는다. 나무 타기 대회 예선에 통과한 조이가 임신한 몸으로 캐나다에서 열리는 본선에 참여하겠다고 주장하자 남자친구 팀은 말도 안 되는 소리라며 일축한다. 하지만 조이는 엄마가 되기 싫다며 나무 타기 대회 챔피언 되기, 대마초 피기 등 '아기 낳기 전에 꼭 해야 할 일'이라는 목록을 만들어 팀에게 동참하기를 강요한다., <br/>팀은 태교 교실에 참여해 조이가 오기를 기다리지만 조이는 전혀 참여할 마음이 없고 오직 캐나다에 갈 생각으로 들떠 있다. 아빠로서 만반의 준비를 갖추고 싶은 팀과 엄마가 될 생각이 없는 조이 사이에 갈등이 커 가던 끝에 둘은 결국 헤어지게 되는데..."
211,대니 트레조의 마가리타 맨,관람객 평점 없음,미국,95분,2020.12,전체 관람가,https://movie-phinf.pstatic.net/20201109_162/16049093079850JVv6_JPEG/movie_image.jpg?type=m203_290_2,코미디,,,,안소니 구아자도, 레네사 샌더스, 대니 트레조,"[""파티에 인생을 건 대학생 '미겔'은 아버지의 학비 지원이 끊기자 퇴학당할 위기에 처한다., <br/>학비를 마련할 방법을 궁리하던 중 미겔이 연 파티 영상이 인터넷에 퍼지고,<br/>'마가리타 맨'이라는 별명을 얻으며 일약 캠퍼스 스타로 떠오른다., <br/>한편, 여학생 클럽 파티를 위해 마가리타 맨 섭외에 나선 티파니는 미겔의 진짜 모습을 보며 서서히 호감을 느끼게 되는데..."
212,징글 쟁글: 저니의 크리스마스,관람객 평점 없음,미국,122분,2020.11.13,전체 관람가,https://movie-phinf.pstatic.net/20201118_252/1605690649904XmXAn_JPEG/movie_image.jpg?type=m203_290_2,가족, 뮤지컬,,,포레스트 휘태커, 키건 마이클 키, 휴 보네빌,믿었던 제자의 배신. 그 후 마법이 떠나버렸다. 한때는 빛났으나 지금은 빛을 잃은 장난감 제작자. 그에게 착하고 호기심 많은 손녀가 찾아온다. 새로운 희망이 다가온다.
214,스토커,관람객 평점 없음,미국,86분,2021.08.12,15세 관람가,https://movie-phinf.pstatic.net/20210723_105/1627005076306IFagO_JPEG/movie_image.jpg?type=m203_290_2,스릴러,,,,크리스틴 고,,,오랜 연인과 엉망진창인 이별을 겪은 앤디 에스코베도는 새롭게 시작하기로 마음먹고 텍사스주 오스틴에서 LA로 이사한다.<br/>앤디는 낯선 도시에서 새로운 인맥을 얻으려고 다소 특이한 구석이 있는 승차 공유 기사 로저와 친구가 된다.<br/>하지만 앤디가 새로 만난 여자 친구 샘과의 연애에 푹 빠져 로저와 거리를 두기 시작하자<br/>로저는 갑자기 이상한 행동을 보이며 앤디의 목을 죄어 오는데...
219,어쌔신 프리스트 벡맨,관람객 평점 없음,미국,97분,2021.05.05,15세 관람가,https://movie-phinf.pstatic.net/20201102_73/1604300078501TBlob_JPEG/movie_image.jpg?type=m203_290_2,액션,,,,데이빗 A.R. 화이트, 제프 파헤이, 버트 영,존경 받는 신부 벡맨은 암살자였던 과거를 숨기고 <br/>사이비 교단에서 탈출한 타비타를 입양하여 건실하게 살고 있다. <br/>어느 날 사이비 교단의 습격으로 타비타는 납치되고 벡맨은 부상을 당한다. <br/>분노한 벡맨은 다시 암살조직에 복귀해 총을 잡게 되고 <br/>교단이 고용한 킬러들과 목숨을 건 대결을 벌인다.
220,마마스 레시피,관람객 평점 없음,미국,104분,2020.12,전체 관람가,https://movie-phinf.pstatic.net/20201102_262/16043025598697pKba_JPEG/movie_image.jpg?type=m203_290_2,코미디, 드라마,,,린다 브래드쇼, 낸시 L. 그레이, 신다 도노반,"한마을에 사는 다섯 친구들 밀리, 수잰, 브렌다, 이본, 애미는 사기꾼의 계략에 빠져 평생 기다려 온 연금을 모두 잃게 된다.<br/>설상가상 맏언니인 수잰이 암에 걸렸다는 사실을 알게 된 다섯 친구들.<br/>수잰의 치료비를 마련하기 위해 이들은 슬픔은 훌훌 털어버리고, 베이커리 사업을 시작하게 되는데..."
221,비겁한 폭력,관람객 평점 없음,한국,84분,2020.11.11,청소년 관람불가,https://movie-phinf.pstatic.net/20201102_248/1604303544308P9jEF_JPEG/movie_image.jpg?type=m203_290_2,범죄, 스릴러,,,나진희,,,"철현은 빚을 갚기 위해 해임을 납치해 비트코인을 빼앗으려 하고 자신에게 소홀해진 애인 연미도 창고에 감금한다.<br/>해임에게는 목적을 이루기 위한 이성적 폭력을, 연미에게는 사랑을 갈구하는 감정적 폭력을 행사하는 철현.<br/>그의 여성 혐오는 극으로 치달아 자신의 폭력을 합리화시키며 두 여자의 충격적인 과거를 밝혀내 삶을 송두리째 흔들어버리려 한다."
226,불어라 검풍아 - 감독판,관람객 평점 없음,한국,99분,2021.04.08,15세 관람가,https://movie-phinf.pstatic.net/20210818_261/1629275473133PUKmI_JPEG/movie_image.jpg?type=m203_290_2,액션,,,,안지혜, 이민지,,"대한민국 최고의 여성 액션 스타를 꿈꾸는 ‘연희’', <br/>우연히 검술 실력으로 목숨이 좌지우지되는', <br/>기묘한 평행세계로 빠져버린다.', <br/>', <br/>자신을 귀인으로 여기는 세계에서', <br/>‘연희’는 악당을 물리치며 정의 구현을 위해 힘쓴다.', <br/>그러던 어느 날, 진짜 ‘귀검’이 등장하며 사건은 꼬이기 시작하는데..!', <br/>', <br/>쥐어진 한 자루의 검! 진짜 나를 깨워라!"
228,2067,관람객 평점 없음,오스트레일리아,114분,2021.06.03,12세 관람가,https://movie-phinf.pstatic.net/20210513_298/1620868327998joC5k_JPEG/movie_image.jpg?type=m203_290_2,SF,,,,코디 스밋 맥피, 라이언 콴튼,,"지구 종말이 도래하고, 산소가 중요한 화폐가 된 서기 2067년.', <br/>‘타임머신’이라고 불리는 일명 ‘크로니컬’이 발명되고,', <br/>407년 뒤, 2474년 미래에서 보낸 메시지가 도착한다.', <br/>', <br/>인류의 마지막 희망, 미래를 구해야만 한다"
230,데빌 인사이드 미,관람객 평점 없음,캐나다,76분,2020.11.30,청소년 관람불가,https://movie-phinf.pstatic.net/20201015_219/1602727437706ot2OG_JPEG/movie_image.jpg?type=m203_290_2,공포,,,,모건 코한, 캬르탄 휴이트, 록 라포툰,"코스타리카의 외딴 저택으로 플렉스 여행을 떠난 토비와 친구들.<br/>토비의 여자 친구인 제이드는 여행에 어울리지 못하고, 계속 불평만 늘어놓는다.<br/>토비의 무관심을 견디다 못한 제이드는 여행지를 벗어나, 낯선 정글 속으로 걸음을 옮기고<br/>그곳에서 정체불명의 생명체와 마주치는데..."
232,메가 블리자드,관람객 평점 없음,미국,72분,2020.12.07,15세 관람가,https://movie-phinf.pstatic.net/20201016_99/1602836311060z3JqD_JPEG/movie_image.jpg?type=m203_290_2,공포,,,,로버트 베를린, 카트리나 맷슨,,"불치병을 완치하는 전설적인 치료제가 설산에서 발견되었다는 제보를 받고, 마틴 박사는 기약 없는 연구를 떠난다.<br/>하지만, 어느 순간 연락이 두절되고 실종된 마틴 박사.<br/>그의 동료 스미스는 마틴의 흔적을 쫓아 설산을 찾지만 알 수 없는 이유로 통신이 단절되고,<br/>설상가상으로 팀원들은 하나둘씩 정체 모를 존재에게 습격을 당해 죽어가는데..."
233,엽문 리부트 2020,관람객 평점 없음,중국,84분,2020.11.26,12세 관람가,https://movie-phinf.pstatic.net/20201112_91/1605147283555Hi10b_JPEG/movie_image.jpg?type=m203_290_2,액션,,,,두우항, 원 리 루오신, 왕민덕,"이소룡의 스승이자 영춘권의 전설적인 고수 ‘엽문’', <br/>그는 젊은 시절 사회의 정의를 지키기 위해 광저우에서 경찰로 복무하던 중', <br/>광저우의 암흑가를 주름 잡던 ‘도끼파’의 방주 ‘삼야’를 살해했다는 누명을 쓴다.', <br/>하지만 ‘삼야’는 친일파를 죽였다는 이유로 암살 당한 것이었고', <br/>그 배후에 부패한 경찰과 광저우를 침공한 일본군이 있음을 알게 된 ‘엽문’은', <br/>‘삼야’의 딸이자 도끼파의 새 당주 ‘청천’과 힘을 합쳐 맞서기로 한다.', <br/>그들의 앞을 막는 일본 상인회 회장 ‘사사키’와 가라데 고수 ‘도쿠가와’!', <br/>‘엽문’은 정의를 위해 모든 것을 거는데…', <br/>', <br/>언제 죽느냐 보다 어떻게 사느냐가 중요하다!', <br/>정의를 위해서 모든 것을 바친 영웅의 이야기가 버라이어티 액션으로 펼쳐진다!"
235,코벤,관람객 평점 없음,미국,80분,2020.12,15세 관람가,https://movie-phinf.pstatic.net/20201022_269/1603356572156kfw1t_JPEG/movie_image.jpg?type=m203_290_2,공포,,,,리즈 고든, 제니퍼 치폴라,,"200년 전, 저주에 걸려 봉인된 마녀신 아슈라. 아슈라의 영혼이 깨어나면, 마녀들은 강력한 힘을 얻을 수 있다.<br/>아슈라를 깨우는 의식을 치르던 중 마녀 한 명이 죽자 남은 마녀들은 빈자리를 채우기 위해 새로운 인물을 찾아 나서는데..."
236,돈 스피크,관람객 평점 없음,영국,83분,2020.12,15세 관람가,https://movie-phinf.pstatic.net/20201022_289/1603357329202vooX8_JPEG/movie_image.jpg?type=m203_290_2,공포,,,,스테파니 로지, 라이언 데이비스, 제이크 왓킨스,"심장마비로 쓰러진 아버지를 만나기 위해 아이들과 함께 고향을 찾은 앨런 부부.<br/>하지만, 이들을 기다리는 건 사람들이 모두 사라진 텅 빈 마을과 불길한 공기뿐이다<br/>무언가 심상치 않은 느낌을 받은 리타와 앨런은 서둘러 도움을 찾아 나서지만<br/>곧 정체를 알 수 없는 괴생명체가 이들 가족을 차례대로 습격하기 시작하는데..."
237,아워 미드나잇,관람객 평점 없음,한국,77분,2021.11.11,12세 관람가,https://movie-phinf.pstatic.net/20211026_289/16352349513576xxlx_JPEG/movie_image.jpg?type=m203_290_2,드라마,,,,이승훈, 박서은, 임영우,"학교 연습실과 옥탑방을 오가며 반 백수처럼 지내는 무명배우 지훈.', <br/>사내연애를 하던 중 말 못할 사건을 겪고 속앓이 하는 직장인 은영.', <br/>지훈이 한강 비밀 순찰 아르바이트를 시작한 날, 두 사람은 우연히 처음 만난다.', <br/>한가로운 밤 산책이 위로가 되는 시간, 같이 걸을래요?"
239,무협강호,관람객 평점 없음,중국,105분,2020.11.13,12세 관람가,https://movie-phinf.pstatic.net/20201112_211/1605164247687gjeks_JPEG/movie_image.jpg?type=m203_290_2,액션,,,,한금명, 허영지, 유을동,"상나라 말기 탐욕스러운 왕비 ‘소달기’는<br/>그녀에게 위협이 되는 축융족 가문의 몰살을 명령한다.<br/>‘소달기’의 정체를 의심하던 왕숙 ‘비간’은 그녀를 암살하려 하지만<br/>주모자라는 사실이 들통나면서 죽음으로 내몰리게 된다.<br/>그는 축융족의 숨겨진 후손 ‘운언’을 찾아가 마지막 부탁을 남기고<br/>‘운언’은 이내 자신이 세상을 구할 유일한 희망임을 깨닫는다.<br/><br/>어둠을 밝힐 마지막 희망이여,<br/>전설의 검을 깨워 무너져가는 세상을 구하라!"
240,해피 데스데이: 악마의 큐피드,관람객 평점 없음,미국,83분,2020.11.30,청소년 관람불가,https://movie-phinf.pstatic.net/20201012_38/1602490532069Cel85_JPEG/movie_image.jpg?type=m203_290_2,공포,,,,조지나 제인, 마이클 오우수,,"[""전교생으로부터 왕따를 당하는 소녀 '페이'., <br/>특히, 같은 학년 엘리스는 부모님 사이의 문제로 페이를 더 심각하게 괴롭힌다.<br/>어느 날, 친구들이 모여 있는 장소에서 공개적으로 페이에게 망신을 준 엘리스.<br/>참다못한 페이는 학교의 괴담처럼 내려오는 악마의 주문을 외우고,<br/>이후 학교에서 공포스러운 사건들이 발생하는데..."
251,컴백 트레일,관람객 평점 없음,미국,103분,2021.10.07,15세 관람가,https://movie-phinf.pstatic.net/20210930_177/1632991761917U3O4J_JPEG/movie_image.jpg?type=m203_290_2,코미디, 범죄,,,로버트 드 니로, 토미 리 존스, 모건 프리먼,사체업자에게 돈을 빚진 영화 제작자 ‘맥스’는 목숨을 구제하기 위해 한물간 영화배우 ‘듀크’를 이용해 촬영 사고로 보험금을 타내려 한다.<br/>하지만 듀크는 맥스가 만들어 논 사고를 기상천외하게 빠져나가고 보험사기 계획은 물거품이 되고마는데…
254,이스케이프 큐브,관람객 평점 없음,프랑스,90분,2021.07.29,청소년 관람불가,https://movie-phinf.pstatic.net/20210728_125/1627432870202xVV6v_JPEG/movie_image.jpg?type=m203_290_2,공포, SF, 드라마,,가이아 와이즈, 피터 프란젠,,눈을 뜨니 비좁은 통로 안에 갇혀버린 리사.<br/>살기 위해선 함정을 피해 빠르게 탈출해야 한다.<br/>정해진 시간 내에 나가지 못한다면 그녀는 죽을 수밖에 없는 운명.<br/>딸의 환영까지 뿌리치며 그녀가 무조건 해야 할 것은 탈출!<br/><br/>과연 그녀는 무사히 통로를 탈출할 수 있을까?
255,퍼펙트 머더: 와이 우먼 킬,관람객 평점 없음,미국,104분,2021.09,전체 관람가,https://movie-phinf.pstatic.net/20210804_31/1628064747963Ffkpc_JPEG/movie_image.jpg?type=m203_290_2,스릴러,,,,나자라 타운젠드, 브레어 그랜트,,"[""평범하고 실력 좋은 미용사 '클레어'는, <br/>밤이 되면 잔혹한 살인을 저지르는 양면의 모습을 감춘 채 살아가고 있다.<br/>어느 날, 단골손님인 '올리비아'에게 강한 호감을 느낀 클레어는 평소에 하지 않던 출장까지 승낙하고, <br/>그녀와 더 친해지기 위해 용기 내어 결혼 축하 파티도 참석하지만 상황은 뜻대로 흘러가지 않는다.<br/>어떻게든 바로잡으려 노력할수록 더 어긋나기만 하는 관계에 클레어의 집착도 뒤틀리기 시작하는데..."
256,맥스 피스트,관람객 평점 없음,미국,90분,2021.03.11,15세 관람가,https://movie-phinf.pstatic.net/20210302_294/16146673022866JHmc_JPEG/movie_image.jpg?type=m203_290_2,액션, 범죄, 모험,,조 맨가니엘로, 스카이랜 브룩스, 글렌 하워튼,"다른 차원의 행성에서 지구로 추락한 히어로 맥스 피스트. 지구로 떨어지며 힘까지 잃은 그의 말을 믿어주는 존재는 ‘햄스터’라는 소년뿐이다. 그러던 중 ‘햄스터’와 유일한 가족인 그의 누나 ‘인디고’가 마약 범죄 조직에 연루되며 목숨을 잃게 생기고, 맥스 피스트는 다시 한번 범죄와 싸워 이겨야 한다."
257,검은 사제들: 지옥의 문,관람객 평점 없음,미국,88분,2020.11.02,15세 관람가,https://movie-phinf.pstatic.net/20200918_203/1600391950200Lpa8b_JPEG/movie_image.jpg?type=m203_290_2,공포,,,,토빈 벨, 랜디 셸리,,"쌍둥이 남매인 스티븐과 미셸은 6년 전에 아버지가 실종되면서 힘든 시간을 보낸다. <br/>미셸은 신앙심으로 과거를 이겨냈지만, 여전히 방황 중인 스티븐은 가족들을 걱정시키고 학교에서 따돌림까지 당한다. <br/>그러던 중 외할아버지인 조지프가 교회에서 부제 서품을 받게 되면서, 이들에게 기이한 사고들이 발생하는데..."
258,스토커 광기의 살인,관람객 평점 없음,헝가리,85분,2020.11.16,청소년 관람불가,https://movie-phinf.pstatic.net/20201026_276/1603674527160bnvJO_JPEG/movie_image.jpg?type=m203_290_2,공포, 스릴러,,,트레버 피터슨, 페르시아 화이트, 케이틀린 제라드,"‘에이미와 외계인’이라는 작품으로 시즌 3까지 인기를 몰았던 작가 겸 제작자인 젭은 시즌 4에서 처참하게 흥행에 실패한다.<br/><br/>아이들의 눈높이에 맞추기보다는 작품의 질을 더 높이 생각하는 젭은 새로운 시즌작에 관한 고민이 깊어지고 상사는 마지막 기회를 준다.<br/>시즌 5의 흥행을 위해 추가된 다양한 작가들과 함께 스키 리조트에 모여 새로운 작품을 만들기 위해 노력하는 젭.<br/>하지만 이것은 젭의 위대한 작품을 위한 하나의 속임수일 뿐, 집 안에 숨겨둔 카메라로 모든 장면을 담고 녹화를 하는데…<br/>과연 희생을 담은 위대한 작품은 완성될 수 있을까?"
259,터키쉬 아이스크림,관람객 평점 없음,터키,123분,2020.11.12,15세 관람가,https://movie-phinf.pstatic.net/20201027_296/1603780108441nQtk8_JPEG/movie_image.jpg?type=m203_290_2,드라마, 전쟁, 코미디,,알리 아타이, 에르칸 콜칵 코스텐딜, 차나이 쿠차란,"오랜 전쟁으로 호주에 정착한 터키 이주민 ‘메멧’, ‘알리’, ‘살림’은<br/>동네에서 알아주는 얼간이들로 한량처럼 하루를 살아간다.<br/>하지만, 전 세계 공기의 흐름이 순식간에 급변하고<br/>호주에 있는 영국 군인들은 그들의 고향인 오스만 제국을 향해 총구를 겨누기 시작한다.<br/>세 얼간이들은 국가를 위해, 가족을 위해<br/>자신들만의 방식으로 유쾌하고 특별한 반란을 시작하는데…<br/><br/>“터키 아이스크림! 찰지고 쫀득한 터키 아이스크림이요!”"
261,포이즌 로즈,관람객 평점 없음,미국,97분,2021.07.28,15세 관람가,https://movie-phinf.pstatic.net/20210709_235/1625820006754LS5W8_JPEG/movie_image.jpg?type=m203_290_2,스릴러,,,,존 트라볼타, 모건 프리먼,,"1978년, LA에서 활동하는 사립 탐정 ‘카슨’(존 트라볼타).', <br/>자신의 고향이었던 텍사스 쪽에 의뢰를 받고 조사에 착수한다.', <br/>내용은 바로 요양원에 있는 한 여성을 찾아달라는 것.', <br/>오랜만에 찾은 고향 텍사스에서 텍사스 최대의 브로커가 된 ‘닥’(모건 프리먼)과 마주하고,', <br/>조사하면 할수록 사건에 ‘닥’과 텍사스 주민들이 연루되어 있다는 걸 알게 되는데…', <br/>', <br/>암묵적 살인, 완벽한 범죄', <br/>상상할 수 없는 일이 현실이 된다"
266,아이 빌리브,관람객 평점 없음,미국,89분,2020.11.05,전체 관람가,https://movie-phinf.pstatic.net/20201022_271/1603334316864GIFQv_JPEG/movie_image.jpg?type=m203_290_2,드라마,,,,로완 스미스, 맷 린드퀴스트, 윌포드 브림리,아홉 살 소년을 통해 <br/>하나님이 없다고 말하는 사람들에게 보여주시는 믿음의 기적!<br/>오로지 기도와 믿음으로만 이뤄낸 꿈만 같은 이야기가 펼쳐진다!
267,라이어트: 기계들의 역습,관람객 평점 없음,미국,88분,2020.12.23,15세 관람가,https://movie-phinf.pstatic.net/20201214_179/1607925540496r9KKf_JPEG/movie_image.jpg?type=m203_290_2,액션, SF, 전쟁,,라이언 메리먼, 제이미 코스타, 새라J. 바솔로뮤,"실력 있는 엘리트 군인들은 낯선 구역 안에서 깨어나게 되고 ', <br/>그들은 이곳에 어떻게 왔는지 전혀 기억하지 못한다. ', <br/>그들과 마주친 인공지능이 탑재된 기계들은 인간의 통제를 거부하고 무차별 공격과 반란을 일으키게 된다. ', <br/>', <br/>인간과 기계의 전투에서 과연 군인들은 어떻게 살아남을 수 있을 것인가?"
268,엠티맨,관람객 평점 없음,미국,137분,2020.11.19,15세 관람가,https://movie-phinf.pstatic.net/20201112_113/1605146903321QDQTx_JPEG/movie_image.jpg?type=m203_290_2,공포, 미스터리,,,제임스 뱃지 데일, 마린 아일랜드, 스티븐 루트,"10대 아이들의 연이은 실종사건으로 공포에 빠진 마을.<br/>은퇴한 전직 경찰 제임스(제임스 뱃지 데일)는 친구의 딸 아만다(사샤 프롤로바)의 실종에 의문을 품고 사건을 조사하기 시작한다. 그는 사건을 파헤치던 중, 전설로 기록된 공포의 존재 ‘엠티맨’과 그를 추종하는 비밀 단체가 아이들의 실종에 연루되어 있음을 깨닫게 된다. 엠티맨의 실체에 다가설수록 목숨마저 위협당하는 공포와 마주하게 되는데….."
