,title,vote,country,time,open_date,grade,poster_path,genre_1,genre_2,genre_3,genre_4,actor_1,actor_2,actor_3,content
809,7 솔져스,관람객 평점 없음,미국,110분,2019.09.19,청소년 관람불가,https://movie-phinf.pstatic.net/20190923_44/1569223076961fxdY9_JPEG/movie_image.jpg?type=m203_290_2,액션, 드라마, 전쟁,,디나 샤하비,,,"군인들이 어떻게 생활하는지, 그들의 인간적인 모습을 알리고 싶어서 미군부대를 따라 아프간 전쟁에 취재 나온 젊은 종군기자 샘 그레이디.', <br/>군인들도 가족과 감정이 있는 똑같은 사람이라는 걸 깨닫게 된다.', <br/>팀을 따라 도보 순찰을 나갔다가 갑자기 탈레반군을 만나게 되고 황급히 벙커를 찾아 숨는다.', <br/>물도 음식도 없는 벙커에서 버티던 중, 폭탄을 찬 아프간 여자가 벙커에 들어온다.', <br/>여자는 폭탄을 터뜨리지 않았고, 순순히 잡혀 의자에 묶인다.', <br/>미군들이 전쟁터에 두고 온 동료들을 구하러 나간 후 샘은 벙커에 여자와 단둘이 남겨지는데..."
810,블랙 호크 다운: 4 솔져스,관람객 평점 없음,미국,70분,2019.09.05,12세 관람가,https://movie-phinf.pstatic.net/20190923_112/1569226953665dtmG3_JPEG/movie_image.jpg?type=m203_290_2,액션, 전쟁,,,알렉산더 라예 피멘텔,,,"서른 세 번째 작전에 투입된 베테랑 부사관 실바.', <br/>현장에 처음 투입되어 자신들을 리드하는 중위가 답답하기만 하다.', <br/>적진에 들어와 있는 와중에 트럭이 고장 나 버리고 설상가상으로 무전기도 터지지 않는다.', <br/>결국 팀을 이끌고 도보로 적진을 빠져나가야 한다.', <br/>목을 만들어 강을 타고 빠져나가는 작전.', <br/>사관 실바는 어디로 튈지 모르는 부하들과 신뢰할 수 없는 중위까지 이끌고 적진을 가로질러 빠져나가야만 한다.', <br/>뜨거운 전우애와 살고자 하는 희망만을 붙든 채 그들의 전쟁이 시작된다."
811,폐교,관람객 평점 없음,한국,81분,2019.09.05,15세 관람가,https://movie-phinf.pstatic.net/20190814_20/1565746252497lIbtI_JPEG/movie_image.jpg?type=m203_290_2,공포,,,,천이슬, 이윤수, 서도현,"매일 밤 악몽에 시달리는 유라는 오랜만에 고등학교 친구들에게 연락해 만나기로 한다. ', <br/>이제는 촉망 받는 화가로 잘나가는 진태, 일진 출신의 재벌 아들 인석, 인석을 좋아하는 혜진, ', <br/>그리고 은석의 꼬봉이었던 성호는 오랜만에 모인다. 유라는 친구들에게 학창시절 자살한 ', <br/>친구를 기억하냐고 묻는다. 모두들 당황하며 기억이 나지 않는다고 하는 친구들. ', <br/>화장실에 간 유라는 거울에 비친 자신의 모습에 놀라 기절하고 만다. 유라를 집에 데려다 주기 ', <br/>위해 모두 인석의 차를 타고 낯선 길을 가던 친구들은 교통사고가 나고 모두 의식을 잃고 많다. ', <br/>친구들이 깨어난 곳은 낯이 익은 폐교로, 자신들이 다녔지만 이제는 폐교가 된 곳이라는 걸 알게  되는데… ', <br/>어떻게 무슨 일로 친구들은 폐교에 있는 것일까? 유라와 친구들은 하나, 둘 죽음의 공포에 빠져들게 되는데…"
817,걸즈 앤 판처 최종장 제2화,관람객 평점 없음,일본,55분,2020.01.08,12세 관람가,https://movie-phinf.pstatic.net/20191231_249/1577754668531NsRjh_JPEG/movie_image.jpg?type=m203_290_2,애니메이션, 드라마,,,후치가미 마이, 카야노 아이, 오자키 마미,"대학 선발팀과의 시합에서 우승하며 오아라이 여고를 폐교 위기에서 구해낸 미호와 전차도 팀원들은 3학년 선배 모모의 유급 소식을 듣는다.<br/>스포츠 특기생 전형으로 모모의 대학 진학을 돕기로 하고, 20년 만에 부활한 동계 대회 우승을 목표로 다시 한번 의기투합하는 오아라이 여고 전차도 팀.<br/>모모를 대장으로 무한궤도배 토너먼트전에 출전하지만, 첫 경기부터 강호 BC자유 고교를 만나 예상치 못한 위기에 빠지게 되는데…"
822,인비저블 위트니스,관람객 평점 없음,이탈리아,102분,2019.08.28,15세 관람가,https://movie-phinf.pstatic.net/20190716_199/1563239613275nNkP9_JPEG/movie_image.jpg?type=m203_290_2,스릴러,,,,리카르도 스카마르치오, 미리암 레오네, 파브리지오 벤티보글리오,"정신을 잃었다 호텔방에서 깨어난 아드리노는 애인 라우라의 시체를 발견한다. ', <br/>문은 잠겨있고 꼼짝없이 범인으로 몰린 아드리노는 자신의 무죄를 입증해야만 한다. ', <br/>승률 100%의 유능한 변호사가 아드리노를 찾아와 ', <br/>모든 진실을 숨김 없이 말하면 무죄를 만들어 주겠다고 하는데…"
829,카르마,관람객 평점 없음,대만,88분,2019.08.16,청소년 관람불가,https://movie-phinf.pstatic.net/20190809_93/1565311045856orVqQ_JPEG/movie_image.jpg?type=m203_290_2,공포, 스릴러,,,진효동, 임용훤, 주효안,"신입 교사 링 셴이 학교에 부임한 첫 날, 한 학생이 집에서 처참하게 죽는 사고가 발생한다.<br/>그리고 주변의 사람들도 하나 둘 죽어가자 링 셴은 학교의 비밀을 추적하기 시작한다. 매력적이고<br/>지능적인 엘리트 학생들의 모임인 ‘화칭’ 학생 클럽이 몇 년 전 발생한 ""모바일 앱 연쇄 살인범“과<br/>연루되었다는 것을 알게 되고, 진짜 주모자는 셴이 가장 기대하지 않았던 사람으로 판명되는데…"
830,클리닝 레이디,관람객 평점 없음,미국,90분,2021.07.08,청소년 관람불가,https://movie-phinf.pstatic.net/20210714_44/1626241431516QgolS_JPEG/movie_image.jpg?type=m203_290_2,공포, 스릴러,,,알렉시스 피터스, 레이첼 알리그,,"[""자칭 '사랑 중독자' 앨리스는 유부남 마이크와 바람을 피우고 있다., <br/>아무리 노력해도 불륜 관계에서 벗어나지 못하는 앨리스는 정신을 딴 데로 돌리려다가<br/>화상으로 끔찍한 상처를 입은 여자 청소부 셸리와 가까워진다.<br/>너무나 다른 겉모습과 달리 예상치 못한 유대감을 공유하는 두 사람.<br/>그러나 셸리는 사실 외면보다 내면에 더 충격적인 상처를 안고 있었고,<br/>앨리스를 '완벽하게' 만들어 주려는 셸리의 시도는 파국으로 치닫는데...""]"
837,다니엘 이즌 리얼,관람객 평점 없음,미국,100분,2020.04.09,청소년 관람불가,https://movie-phinf.pstatic.net/20200630_95/1593495266292dOoeb_JPEG/movie_image.jpg?type=m203_290_2,스릴러,,,,마일즈 로빈스, 패트릭 슈왈제네거, 사샤 레인,"어릴적 총기사건의 끔찍하게 죽은 피해자들을 보고 트라우마를 얻게 된 소년 ‘루크’는 자신에게만 보이는 상상 속의 친구 ‘다니엘’을 만나게 된다. ‘다니엘’의 말을 따라 엄마를 죽일 뻔한 ‘루크’는 ‘다니엘’을 자신만의 방법으로, 인형의 집에 가둔다. 대학생이 된 ‘루크’는 자신에게 감당할 수 없는 일들이 일어나자, 이를 해결하기 위해 잊고 있었던 친구 ‘다니엘’을 다시 불러 내고, ‘다니엘’은 이것을 이용해 ‘루크’를 지배하려 하는데… 과연, ‘루크’는 ‘다니엘’을 없앨 수 있을 것인가?"
839,송 오브 러브,관람객 평점 없음,뉴질랜드,93분,2020.09.10,12세 관람가,https://movie-phinf.pstatic.net/20200902_123/1599036322881IAGdy_JPEG/movie_image.jpg?type=m203_290_2,드라마, 뮤지컬,,,조지 메이슨, 로즈 맥아이버, 킴브라,누구보다 뜨겁게 사랑하고 차갑게 이별해야 했던 로즈와 에릭<br/>그리고 이 세상 모든 연인들을 위한 뮤직 러브스토리
841,패트리어트 워,관람객 평점 없음,러시아 연방,105분,2019.06.20,12세 관람가,https://movie-phinf.pstatic.net/20210901_47/1630485263890PjWme_JPEG/movie_image.jpg?type=m203_290_2,드라마, 전쟁,,,이고르 베로에프,,,"1941년 10월, 독일군은 모스크바의 한 마을로 진격 중이다.', <br/>탱크도 무기고도 없는 최악의 상황의 마을.', <br/>마을은 이미 친나치 단체가 숨어들어 방어를 약화시키고 있다.', <br/>누가 나치군인지 알 수 없는 상황,', <br/>마을 저항군에게 남은 선택지는 단, 두가지뿐', <br/>과연, 혹독한 추위와 험난한 전쟁 상황 속에서 마을을 지킬 수 있을 것인가!"
842,킹 다닐로,관람객 평점 없음,우크라이나,85분,2019.06.27,15세 관람가,https://movie-phinf.pstatic.net/20190613_150/1560416385072vWPKd_JPEG/movie_image.jpg?type=m203_290_2,액션, 모험,,,세히 이아르모센코,,,"위대한 통치자 로만 공작이 죽은 뒤, 귀족들이 권력을 나누어 가져 나라가 흉흉할 때, 공작의 두 아들인 다닐로와 바실코는 아버지의 유산을 되찾기 위해 수도를 홀름으로 새로이 정하고 왕국을 넓힌다.<br/>이때 중앙 유럽에서 세를 넓히고 있던 몽골은 다닐로에게 큰 위협이 되고 다닐로를 눈엣가시로 여기던 귀족들은 몽골과 협약을 맺어 다닐로를 없애버리려는 계획을 세운다.<br/>대대적인 군사를 이끌고 몽골과 전쟁을 치른 다닐로는 계속되는 몽골과 귀족의 위협에 새로운 전쟁을 치르려 하는데..."
843,도신 외전,관람객 평점 없음,중국,79분,2019.08.05,15세 관람가,https://movie-phinf.pstatic.net/20190717_88/1563330627282g7cHO_JPEG/movie_image.jpg?type=m203_290_2,액션,,,,장치항,,,"치외법권의 망망대해, 초호화 여객선에서 열리는 암흑 조직 간의 명운이 걸린 도박판.', <br/>경찰은 중국 최대 조직의 두목 바오자가 참가한다는 첩보를 입수하고 ', <br/>‘거리의 도신’으로 불리는 서가보를 배에 잠입시킨다.', <br/>아픈 동생의 수술비를 벌기 위해서 서가보는 위험한 게임에 참여하게 되고 ', <br/>가족과 친구를 위해, 명예와 의리를 위해 목숨을 건 한판 도박을 시작하게 되는데…"
844,완벽한 살인,관람객 평점 없음,미국,80분,2019.06.20,15세 관람가,https://movie-phinf.pstatic.net/20190528_169/1559005346265yaf13_JPEG/movie_image.jpg?type=m203_290_2,액션, 스릴러,,,타라 맥큰, 제이 로드리게스,,"임종을 앞둔 할머니를 수년 만에 찾은 손자 ‘대니’', <br/>‘대니’는 전과범들과 함께 유산을 빼돌리려는 속셈이다.', <br/>하지만 할머니가 돈을 내어줄 기미를 전혀 보이지 않고,', <br/>설상가상, 평범한 요양사인줄 알았던 여자의 행동이 수상한데…', <br/>', <br/>돈 앞에선 독고다이, 유산을 독식하기 위한 살인게임이 시작된다!"
845,트레킹: 저주의 숲,관람객 평점 없음,독일,96분,2019.07.11,15세 관람가,https://movie-phinf.pstatic.net/20190612_173/1560324265423g0S2K_JPEG/movie_image.jpg?type=m203_290_2,모험,,,,올리버 마수치, 루이스 호프만,,"아내의 갑작스러운 죽음으로 아들과 헤어지게 된 아버지.<br/>10년 만에 재회를 앞둔 부자는 서로 가까워지기를 기대하며 산악 여행을 계획한다.<br/>하지만 두 사람 모두 쉽게 마음을 열지 못하고 서로를 비난하기 바쁘다.<br/>엎친 데 덮친 격으로 장비까지 모두 잃어버리고, 즐거워야 할 여행은 어느새 생존을 위한 싸움이 되는데.."
851,텐: 시크릿 미션,관람객 평점 없음,인도네시아,88분,2019.08.12,청소년 관람불가,https://movie-phinf.pstatic.net/20190805_125/1564995864440BQtUf_JPEG/movie_image.jpg?type=m203_290_2,액션, 범죄, 드라마,,카레리나 마리아, 제레미 토마스, 지브란 마르텐,"인도네시아의 섬, 수백 명의 주민들이 인질로 잡혔다.<br/>테러 집단은 미국인 대사관의 딸 켈리의 몸값을 요구하고,<br/>국가 비밀 정보 기관 SIS는 군 병력이 동원되기 전,<br/>빠른 시간 내에 섬에 침입하라는 임무를 맡게 된다.<br/>존 대령은 유능한 미녀 모델 10명을 영입해<br/>전투 요원으로 훈련시키려 하지만 이는 쉽지 않고,<br/>최정예 요원들의 목숨을 건 대망의 작전일은 점점 다가오는데…"
855,피터팬: 후크 선장과 결투의 날,관람객 평점 없음,아일랜드,88분,2019.05.30,전체 관람가,https://movie-phinf.pstatic.net/20190523_209/1558573046918kEl0n_JPEG/movie_image.jpg?type=m203_290_2,애니메이션, 모험,,,장은숙, 안종덕, 장경희,일 년 중 낮이 가장 긴 오늘은 네버랜드의 단 하루뿐인 축제가 벌어지는 날!<br/>즐거운 하루를 계획하던 피터팬과 친구들 앞에 영원한 라이벌 후크 선장이 등장한다.<br/>네버랜드의 알려지지 않은 위험한 비밀이 담긴 마법책을 손에 넣은 후크 선장은<br/>피터팬과 웬디 일행을 점점 더 위험한 상황으로 몰아넣기 시작하는데…<br/><br/>과연 피터팬은 새로운 악당들의 등장으로<br/>역대급 위험에 처한 네버랜드를 구할 수 있을까?
856,본 투 드라이브,관람객 평점 없음,노르웨이,92분,2020.11.25,전체 관람가,https://movie-phinf.pstatic.net/20201119_242/1605761003417OkKkG_JPEG/movie_image.jpg?type=m203_290_2,다큐멘터리,,,,올리버 솔베르그, 파닐라 솔베르그, 피터 솔베르그,노르웨이의 카레이싱 세계 챔피언 부부인<br/>‘페르닐라 솔베르그’와 ‘페테르 솔베르그’의 아들 ‘올리버’!<br/>‘올리버’는 15살 나이에 처음으로 참여한 레이싱에서<br/>3위를 차지하며 천재 소년 레이서로 떠오른다<br/><br/>‘올리버’는 꿈을 위해 프랑스의 레이싱 학교에 입학하고<br/>자신보다 뛰어난 동기들과 함께 경쟁한다.<br/><br/>그러던 와중 레이스에 참가한 아버지의 부상 소식을 듣게 되고<br/>이제 ‘올리버’는 아버지의 명예를 건 새로운 질주를 시작하는데…
858,공수도,관람객 평점 없음,한국,112분,2020.04.09,15세 관람가,https://movie-phinf.pstatic.net/20200218_234/1581990954625bPxTq_JPEG/movie_image.jpg?type=m203_290_2,액션, 코미디,,,오승훈, 정다은, 손우현,공수도장을 운영하는 아빠로부터 공수도를 배워온 소녀 ‘채영’이 홀어머니를 모시고 사는 순수하고 정의로운 소년 ‘종구’와 일진의 생활에 염증을 느끼고 새로운 시작을 위해 애쓰는 ‘해성’을 만나 공수도를 통해 함께 성장해가는 청춘 액션물
861,좋은 여자,관람객 평점 없음,한국,100분,2020.05.28,청소년 관람불가,https://movie-phinf.pstatic.net/20200515_156/1589506001837O5Q76_PNG/movie_image.jpg?type=m203_290_2,드라마,,,,안민영, 조은주, 은하수,"갱년기를 겪으며 갑상선 암에 걸려 힘들게 살아가는 퇴폐마사지업소의 경숙. 보고 싶었던 딸의 결혼 소식을 들은 경숙은 도박으로 자신의 인생을 망치고 가정을 파탄시킨, 다시는 보고 싶지 않은 남편 유병호를 찾으러 강원도 태백으로 간다. 거친 눈보라를 헤치며 찾아다니지만 그 어디에도 남편은 없는데... 갑자기 복받쳐 오는 서러움과 분노가 그녀의 가슴과 머리를 어지럽힌다."
862,컴 애즈 유 아,관람객 평점 없음,미국,107분,2021.05.06,15세 관람가,https://movie-phinf.pstatic.net/20210421_137/1618970936617aMQVn_JPEG/movie_image.jpg?type=m203_290_2,코미디, 드라마,,,그랜트 로젠마이어, 헤이든 제토, 레비 파텔,"몸을 움직일 수 없는 스코티, 다리를 움직일 수 없는 맷, 앞을 보지 못하는 모는<br/>누군가의 도움을 받으며, 병원 만을 오가는 일상이 답답하기만 하다.<br/>스코티는 일생일대의 꿈을 이루기 위해 맷, 모와 함께 생애 첫 여행이라는<br/>인생 최대의 일탈을 하고 마는데...<br/><br/>보호나 허락은 필요 없어! 막무가내 코믹 로드트립이 시작됐다!"
865,6솔져스,관람객 평점 없음,터키,105분,2019.05.16,15세 관람가,https://movie-phinf.pstatic.net/20190508_297/1557282152384xSDsb_JPEG/movie_image.jpg?type=m203_290_2,액션, 전쟁,,,케렘 버신,,,"터키 국경 지역에서 잔악무도한 테러 단체가 판치는 가운데, 알파슬란 대위가 이끄는 특수부대가 아군을 돕기 위해 진격에 나선다.<br/>하지만 알파슬란의 절친한 동료이자 공군 소속 오누르 대위가 공습 도중 실종된다.<br/>이에 알파슬란의 6명 특수 부대원은 테러범보다 먼저 오누르 대위를 찾기 위해, 그리고 조국을 지키기 위한 마지막 방어선을 지키기 위해 목숨을 바친 위험한 전쟁을 시작하는데...!<br/>어떤 상황에서도 끝까지 전진한다! 거대한 테러에 맞선 위대한 전쟁을 확인하라!"
875,리틀 조,관람객 평점 없음,오스트리아,105분,2021.04.01,12세 관람가,https://movie-phinf.pstatic.net/20210325_132/16166613479694u39i_JPEG/movie_image.jpg?type=m203_290_2,드라마, 공포, 미스터리,,에밀리 비샴, 벤 위쇼, 키트 코너,"[""싱글맘이자 새로운 식물품종을 만들어내는 연구원 앨리스. 아들을 돌보며 꽃박람회 출품을 야심 차게 준비하고 있던 그녀는 사람들을 행복하게 해주는 식물을 배양해내는 데 성공하고, 아들의 이름을 따라 '리틀 조'라고 이름 붙인다."", <br/>', <br/>자신의 연구가 성공했다고 믿는 앨리스는 아직 승인도 나지 않은 식물 리틀 조를 아들 조에게 선물한다. 혼자 보내는 시간이 많던 조는 화분에 말도 걸고 물도 주며 리틀 조를 극진히 돌본다. 그러나 마침내, 리틀 조가 꽃을 피우기 시작하자 조는 전과 다른 말과 행동을 보이며 점점 낯선 존재가 되어가기 시작하는데…', <br/>', <br/>아름다움에 현혹되지 마라"
878,배신자,관람객 평점 없음,이탈리아,152분,2019.11.21,15세 관람가,https://movie-phinf.pstatic.net/20191121_190/1574309897349h7RWw_JPEG/movie_image.jpg?type=m203_290_2,범죄, 드라마,,,피에르프란체스코 파비노, 아레시오 프레티코, 루이지 로 카시오,"1980년 초, 마약 공급권을 두고 이탈리아 마피아의 신구 패밀리 사이의 갈등이 고조되자 토마소 부세타는 조직생활을 청산하고 가족과 함께 브라질로 떠난다. <br/>그러나 얼마 지나지 않아 그는 마피아의 신진세력인 콜레오네파가 자신의 동료들과 일가친척의 절반을 살해하고, 팔레르모에 두고 온 두 아들마저 실종됐다는 소식을 듣고 절망한다. <br/>얼마 후, 토마소는 브라질 경찰에 마약 거래 혐의로 체포되고 이탈리아로 송환이 결정되자 이탈리아 사법기관에 마피아의 모든 것을 폭로하려는 위험한 결정을 하기에 이르는데..."
880,큐리오사,관람객 평점 없음,프랑스,105분,2020.08.06,청소년 관람불가,https://movie-phinf.pstatic.net/20200714_102/1594703818201BeHAY_JPEG/movie_image.jpg?type=m203_290_2,드라마, 멜로/로맨스,,,노에미 메를랑, 니엘스 슈나이더, 벤자민 라베른헤,"19세기 파리. 자유로운 영혼의 시인 피에르(니엘스 슈나이더)와 마리(노에미 메를랑)는 서로 사랑하지만, 마리는 부모님의 뜻을 따라 피에르의 친구와 결혼을 한다. ', <br/>상처받은 피에르는 알제리로 떠나고, 그곳에서 예술적인 영감을 주는 매혹적인 뮤즈 조흐라(카멜리아 조르다나)를 만나 그녀의 누드사진을 찍기 시작한다.', <br/>', <br/>“남편이 되지 못했으니 연인이 돼 줄게.”', <br/>', <br/>1년 후. 애정 없는 결혼생활을 이어가던 마리는 피에르가 조흐라와 함께 파리에 돌아왔다는 소식을 듣고 그를 찾아간다. 여전히 서로를 잊지 못하고 있던 마리와 피에르는 은밀한 관계를 이어가고, 마리는 피에르의 사진작품들을 보며 자신의 누드사진을 찍어달라고 하는데…', <br/>', <br/>“사진 모델이 되고 싶어요. 도덕 따윈 아랑곳하지 않는 자세로.”"
883,컴 투 대디 : 30년만의 재회,관람객 평점 없음,미국,93분,2020.11.03,청소년 관람불가,https://movie-phinf.pstatic.net/20200828_1/15985764918631qHQR_JPEG/movie_image.jpg?type=m203_290_2,공포, 스릴러,,,일라이저 우드, 스티븐 맥허티,,나름 성공한 음악가 노발.  <br/>아버지가 없이 자란 그에게 갑자기 아버지로 부터의 초대장이 온다. <br/>30여년간 가족을 버린 아버지에 대한 궁금증과 원망을 품고 그를 만나러 간 외딴집. 아버지는 노발을 반갑게 맡아 준다. 노발은 기대했던 모습과 다른 아버지의 모습에 당황하지만 그래도 함께 저녁을 먹으며 시간을 보낸다.<br/>하지만 어딘가 이상한 느낌을 받은 노발은 아버지의 집을 살펴보던 중 집안 곳곳에서 핏자국을 발견하게 된다. <br/>노발은 30년만에 만난 아버지의 섬뜩한 실체를 알게 되는데…
890,죽도 서핑 다이어리,관람객 평점 없음,한국,104분,2020.05.07,12세 관람가,https://movie-phinf.pstatic.net/20200506_238/15887257963532sJ3j_JPEG/movie_image.jpg?type=m203_290_2,드라마,,,,전혜빈, 정태우, 오광록,"죽도의 12살 소녀 서퍼 비주, <br/>그 시선에는 서퍼가 아닌 사람들이 더 눈에 띈다.<br/>해변에 캠핑중인 수정, 오래 동안 그곳을 떠나 있다 돌아온 정용. <br/>파도가 있는 날은 모든 것을 내팽개치고 미친듯이 서핑을 하는 죽도 서퍼들,<br/>두 사람도 어쩔 수 없이 서핑을 만나게 된다.<br/><br/>한편 서핑 핫 플레이스로 떠오른 죽도 해변은 그 열기로 몸살을 앓게 된다.<br/>파도가 넘실거리 듯 시간은 흘러가고 <br/>결국 비주도 그곳을 떠날 운명에 처하게 되는데…"
893,크로우 라이징,관람객 평점 없음,영국,90분,2019.05.21,15세 관람가,https://movie-phinf.pstatic.net/20190516_175/1557970869087pduM9_JPEG/movie_image.jpg?type=m203_290_2,공포,,,,클레어-마리아 폭스, 매니 제이 몬타나, 클루딘- 헬렌 아모르,몇 대에 걸쳐 내려온 허수아비의 전설이 있다. 하지만 아무도 모르는 이야기가 있는데 바로 허수아비에게 약혼자 메리 루가 있었다는 것이었다. 메리 루의 후손들은 더 이상의 희생자가 발생되게 하지 않기 위해 노력해왔다. 메이는 메리 루의 후손으로 그들의 땅을 상속받게 되었는데 그날이 바로 허수아비가 신부를 찾기 위해 나타나는 시기였다. 허수아비는 유독 메리 루와 똑같이 닮은 메이를 잡기 위해 메이의 친구들을 하나씩 죽이기 시작하는데...
895,무협: 강호수사대,관람객 평점 없음,중국,90분,2019.06.05,15세 관람가,https://movie-phinf.pstatic.net/20190524_73/1558679134040VihpB_JPEG/movie_image.jpg?type=m203_290_2,액션,,,,상용,,,"강호에 고수들이 모여들고 대결이 끊이지 않는다.<br/>살인 사건을 조사하던 수사대는<br/>사라진 왕국의 보물 때문인 것을 알게 되는데,<br/>드디어 고수들의 전면적인 결전이 시작된다.<br/>10대 고수와 수사대의 대결을 목격하라!"
896,블랙 스완: 흑화,관람객 평점 없음,미국,84분,2019.06.12,청소년 관람불가,https://movie-phinf.pstatic.net/20190530_197/1559207149145yrpWt_JPEG/movie_image.jpg?type=m203_290_2,공포, 스릴러,,,켄드라 카렐리, 캐롤라인 윌리엄스, 데비 로천,주목 받는 발레리나 아드리아나는 차이코프스키의 발레 ‘호두까기 인형’ 주연을 맡은 이후 끔찍한 환영과 악몽에 시달린다. 심지어 그녀의 주변인들이 하나씩 무참히 살해당하기 시작한다. 이제 남은 것은 그녀 하나뿐! 충격적인 핏빛 발레의 진실이 드러난다.
897,파라노말 액티비티 2019,관람객 평점 없음,미국,90분,2019.09.17,15세 관람가,https://movie-phinf.pstatic.net/20190918_185/1568793267510nVwDH_JPEG/movie_image.jpg?type=m203_290_2,공포, 액션,,,로리 커밍스, 렛 터렐,,갓 태어난 아기를 키우며 살던 금슬 좋은 부부. 모든 것이 완벽해 보이던 그때 어느 날 밤부터 남편이 몽유병에 시달리기 시작한다. 아내와 아기의 안전까지 위협하는 남편의 이상행동. 이 사람이 정말 내 남편이 맞을까? 가족 사이에 숨겨진 끔찍한 살인저주가 그 실체를 드러낸다.
898,침입자,관람객 평점 없음,영국,101분,2019.09.10,청소년 관람불가,https://movie-phinf.pstatic.net/20190822_44/1566451288288Y68om_JPEG/movie_image.jpg?type=m203_290_2,공포,,,,케이트 마리 데이비스,,,휴가 차 가족들과 캠핑을 온 캐서린은 갑자기 텐트에 불이 붙는 기이한 사건을 겪는다.<br/>알고 보니 이곳은 불에 타 죽은 소년이 출몰한다는 괴담이 도는 곳.<br/>게다가 의문의 남성까지 나타나 가족들을 납치 및 고문하기 시작한다.<br/>농장에 숨겨진 충격적 비밀을 알게 된 캐서린은 가족들과 함께 살아남기 위해 최후의 방법을 결심한다.
